Number (phenomenon),Phenomenon,Number (paradigm),Paradigm,Item,Grammaticality,Sentence,Critical word(s),Cue word(s)
9,Adverbial Modification,42,position_type,1,Grammatical,Adam zag dat het publiek gelukkig hard heeft gelachen.,gelukkig hard,
9,Adverbial Modification,42,position_type,1,Ungrammatical,Adam zag dat het publiek hard gelukkig heeft gelachen.,hard gelukkig,
9,Adverbial Modification,42,position_type,2,Grammatical,Bram dacht dat de werknemer mogelijk snel zou vertrekken.,mogelijk snel,
9,Adverbial Modification,42,position_type,2,Ungrammatical,Bram dacht dat de werknemer snel mogelijk zou vertrekken.,snel mogelijk,
9,Adverbial Modification,42,position_type,3,Grammatical,Cas hoorde dat de collega blijkbaar traag heeft gewerkt.,blijkbaar traag,
9,Adverbial Modification,42,position_type,3,Ungrammatical,Cas hoorde dat de collega traag blijkbaar heeft gewerkt.,traag blijkbaar,
9,Adverbial Modification,42,position_type,4,Grammatical,Daan wist dat zijn vriendin natuurlijk goed had gezongen.,natuurlijk goed,
9,Adverbial Modification,42,position_type,4,Ungrammatical,Daan wist dat zijn vriendin goed natuurlijk had gezongen.,goed natuurlijk,
9,Adverbial Modification,42,position_type,5,Grammatical,Emir dacht dat de man waarschijnlijk langzaam zou zwemmen.,waarschijnlijk langzaam,
9,Adverbial Modification,42,position_type,5,Ungrammatical,Emir dacht dat de man langzaam waarschijnlijk zou zwemmen.,langzaam waarschijnlijk,
9,Adverbial Modification,42,position_type,6,Grammatical,Fleur hoorde dat de spreker ongetwijfeld zacht had gesproken.,ongetwijfeld zacht,
9,Adverbial Modification,42,position_type,6,Ungrammatical,Fleur hoorde dat de spreker zacht ongetwijfeld had gesproken.,zacht ongetwijfeld,
9,Adverbial Modification,42,position_type,7,Grammatical,Gwen zag dat de student zeker mooi heeft geschreven.,zeker mooi,
9,Adverbial Modification,42,position_type,7,Ungrammatical,Gwen zag dat de student mooi zeker heeft geschreven.,mooi zeker,
9,Adverbial Modification,42,position_type,8,Grammatical,Hanna wist dat de man misschien voorzichtig zou opereren.,misschien voorzichtig,
9,Adverbial Modification,42,position_type,8,Ungrammatical,Hanna wist dat de man voorzichtig misschien zou opereren.,voorzichtig misschien,
9,Adverbial Modification,42,position_type,9,Grammatical,Iris zag dat de jongen duidelijk graag had gesport.,duidelijk graag,
9,Adverbial Modification,42,position_type,9,Ungrammatical,Iris zag dat de jongen graag duidelijk has gesport.,graag duidelijk,
9,Adverbial Modification,42,position_type,10,Grammatical,Julia hoorde dat de docent mogelijk luid zou schreeuwen.,mogelijk luid,
9,Adverbial Modification,42,position_type,10,Ungrammatical,Julia hoorde dat de docent luid mogelijk zou schreeuwen.,luid mogelijk,
9,Adverbial Modification,42,position_type,11,Grammatical,Koen wist dat de chauffeur duidelijk snel had gereageerd.,duidelijk snel,
9,Adverbial Modification,42,position_type,11,Ungrammatical,Koen wist dat de chauffeur snel duidelijk had gereageerd.,snel duidelijk,
9,Adverbial Modification,42,position_type,12,Grammatical,Lars zag dat de acteur waarschijnlijk goed had geacteerd.,waarschijnlijk goed,
9,Adverbial Modification,42,position_type,12,Ungrammatical,Lars zag dat de acteur goed waarschijnlijk had geacteerd.,goed waarschijnlijk,
9,Adverbial Modification,42,position_type,13,Grammatical,Maartje hoorde dat haar vriendin zeker op tijd was gekomen.,zeker op tijd,
9,Adverbial Modification,42,position_type,13,Ungrammatical,Maartje hoorde dat haar vriendin op tijd zeker was gekomen.,op tijd zeker,
9,Adverbial Modification,42,position_type,14,Grammatical,Niels wist dat de klant mogelijk tevreden was geweest.,mogelijk tevreden,
9,Adverbial Modification,42,position_type,14,Ungrammatical,Niels wist dat de klant tevreden mogelijk was geweest.,tevreden mogelijk,
9,Adverbial Modification,42,position_type,15,Grammatical,Olivia zag dat de chef ongetwijfeld streng had beoordeeld.,ongetwijfeld streng,
9,Adverbial Modification,42,position_type,15,Ungrammatical,Olivia zag dat de chef streng ongetwijfeld had beoordeeld.,streng ongetwijfeld,
9,Adverbial Modification,42,position_type,16,Grammatical,Pieter hoorde dat de muzikant blijkbaar goed had gespeeld.,blijkbaar goed,
9,Adverbial Modification,42,position_type,16,Ungrammatical,Pieter hoorde dat de muzikant goed blijkbaar had gespeeld.,goed blijkbaar,
9,Adverbial Modification,42,position_type,17,Grammatical,Quinten wist dat de leerling misschien slim was geweest.,misschien slim,
9,Adverbial Modification,42,position_type,17,Ungrammatical,Quinten wist dat de leerling slim misschien was geweest.,slim misschien,
9,Adverbial Modification,42,position_type,18,Grammatical,Roos zag dat de klant ongetwijfeld vriendelijk had gereageerd.,ongetwijfeld vriendelijk,
9,Adverbial Modification,42,position_type,18,Ungrammatical,Roos zag dat de klant vriendelijk ongetwijfeld had gereageerd.,vriendelijk ongetwijfeld,
9,Adverbial Modification,42,position_type,19,Grammatical,Sander hoorde dat de presentator mogelijk grappig had gesproken.,mogelijk grappig,
9,Adverbial Modification,42,position_type,19,Ungrammatical,Sander hoorde dat de presentator grappig mogelijk had gesproken.,grappig mogelijk,
9,Adverbial Modification,42,position_type,20,Grammatical,Tessa wist dat de deelnemer blijkbaar goed had gepresteerd.,blijkbaar goed,
9,Adverbial Modification,42,position_type,20,Ungrammatical,Tessa wist dat de deelnemer goed blijkbaar had gepresteerd.,goed blijkbaar,
9,Adverbial Modification,42,position_type,21,Grammatical,Umut zag dat de atleet waarschijnlijk hard had getraind.,waarschijnlijk hard,
9,Adverbial Modification,42,position_type,21,Ungrammatical,Umut zag dat de atleet hard waarschijnlijk had getraind.,hard waarschijnlijk,
9,Adverbial Modification,42,position_type,22,Grammatical,Valerie hoorde dat de medewerker zeker behulpzaam was geweest.,zeker behulpzaam,
9,Adverbial Modification,42,position_type,22,Ungrammatical,Valerie hoorde dat de medewerker behulpzaam zeker was geweest.,behulpzaam zeker,
9,Adverbial Modification,42,position_type,23,Grammatical,Wouter wist dat de vriend waarschijnlijk eerlijk had verteld.,waarschijnlijk eerlijk,
9,Adverbial Modification,42,position_type,23,Ungrammatical,Wouter wist dat de vriend eerlijk waarschijnlijk had verteld.,eerlijk waarschijnlijk,
9,Adverbial Modification,42,position_type,24,Grammatical,Xenia zag dat de schilder ongetwijfeld creatief had gewerkt.,ongetwijfeld creatief,
9,Adverbial Modification,42,position_type,24,Ungrammatical,Xenia zag dat de schilder creatief ongetwijfeld had gewerkt.,creatief ongetwijfeld,
9,Adverbial Modification,42,position_type,25,Grammatical,Yannick hoorde dat de actrice misschien emotioneel was geweest.,misschien emotioneel,
9,Adverbial Modification,42,position_type,25,Ungrammatical,Yannick hoorde dat de actrice emotioneel misschien was geweest.,emotioneel misschien,
9,Adverbial Modification,42,position_type,26,Grammatical,Alex zag dat de zanger waarschijnlijk vals had gezongen.,waarschijnlijk vals,
9,Adverbial Modification,42,position_type,26,Ungrammatical,Alex zag dat de zanger vals waarschijnlijk had gezongen.,vals waarschijnlijk,
9,Adverbial Modification,42,position_type,27,Grammatical,Bianca hoorde dat de leerkracht ongetwijfeld geduldig was geweest.,ongetwijfeld geduldig,
9,Adverbial Modification,42,position_type,27,Ungrammatical,Bianca hoorde dat de leerkracht geduldig ongetwijfeld was geweest.,geduldig ongetwijfeld,
9,Adverbial Modification,42,position_type,28,Grammatical,Denise zag dat de monteur blijkbaar snel had gerepareerd.,blijkbaar snel,
9,Adverbial Modification,42,position_type,28,Ungrammatical,Denise zag dat de monteur snel blijkbaar had gerepareerd.,snel blijkbaar,
9,Adverbial Modification,42,position_type,29,Grammatical,Eli zag dat de hond waarschijnlijk vrolijk had gespeeld.,waarschijnlijk vrolijk,
9,Adverbial Modification,42,position_type,29,Ungrammatical,Eli zag dat de hond vrolijk waarschijnlijk had gespeeld.,vrolijk waarschijnlijk,
9,Adverbial Modification,42,position_type,30,Grammatical,Femke hoorde dat de klant ongetwijfeld tevreden was geweest.,ongetwijfeld tevreden,
9,Adverbial Modification,42,position_type,30,Ungrammatical,Femke hoorde dat de klant tevreden ongetwijfeld was geweest.,tevreden ongetwijfeld,
9,Adverbial Modification,42,position_type,31,Grammatical,Gert-Jan wist dat de trainer mogelijk tactisch had opgesteld.,mogelijk tactisch,
9,Adverbial Modification,42,position_type,31,Ungrammatical,Gert-Jan wist dat de trainer tactisch mogelijk had opgesteld.,tactisch mogelijk,
9,Adverbial Modification,42,position_type,32,Grammatical,Hanneke zag dat de kat blijkbaar rustig had geslapen.,blijkbaar rustig,
9,Adverbial Modification,42,position_type,32,Ungrammatical,Hanneke zag dat de kat rustig blijkbaar had geslapen.,rustig blijkbaar,
9,Adverbial Modification,42,position_type,33,Grammatical,Ivar hoorde dat de leerling waarschijnlijk goed had geleerd.,waarschijnlijk goed,
9,Adverbial Modification,42,position_type,33,Ungrammatical,Ivar hoorde dat de leerling goed waarschijnlijk had geleerd.,goed waarschijnlijk,
9,Adverbial Modification,42,position_type,34,Grammatical,Jasmijn wist dat de spreker ongetwijfeld interessant had gesproken.,ongetwijfeld interessant,
9,Adverbial Modification,42,position_type,34,Ungrammatical,Jasmijn wist dat de spreker interessant ongetwijfeld had gesproken.,interessant ongetwijfeld,
9,Adverbial Modification,42,position_type,35,Grammatical,Karel zag dat de schilder mogelijk abstract had geschilderd.,mogelijk abstract,
9,Adverbial Modification,42,position_type,35,Ungrammatical,Karel zag dat de schilder abstract mogelijk had geschilderd.,abstract mogelijk,
9,Adverbial Modification,42,position_type,36,Grammatical,Luna hoorde dat de atleet zeker snel had gelopen.,zeker snel,
9,Adverbial Modification,42,position_type,36,Ungrammatical,Luna hoorde dat de atleet snel zeker had gelopen.,snel zeker,
9,Adverbial Modification,42,position_type,37,Grammatical,Martijn wist dat de student waarschijnlijk hard had gestudeerd.,waarschijnlijk hard,
9,Adverbial Modification,42,position_type,37,Ungrammatical,Martijn wist dat de student hard waarschijnlijk had gestudeerd.,hard waarschijnlijk,
9,Adverbial Modification,42,position_type,38,Grammatical,Noa zag dat de gast blijkbaar tevreden had gegeten.,blijkbaar tevreden,
9,Adverbial Modification,42,position_type,38,Ungrammatical,Noa zag dat de gast tevreden blijkbaar had gegeten.,tevreden blijkbaar,
9,Adverbial Modification,42,position_type,39,Grammatical,Oscar hoorde dat de actrice misschien nerveus was geweest.,misschien nerveus,
9,Adverbial Modification,42,position_type,39,Ungrammatical,Oscar hoorde dat de actrice nerveus misschien was geweest.,nerveus misschien,
9,Adverbial Modification,42,position_type,40,Grammatical,Pien wist dat de klant ongetwijfeld tevreden was geweest.,ongetwijfeld tevreden,
9,Adverbial Modification,42,position_type,40,Ungrammatical,Pien wist dat de klant tevreden ongetwijfeld was geweest.,tevreden ongetwijfeld,
9,Adverbial Modification,42,position_type,41,Grammatical,Quinty zag dat de manager waarschijnlijk goed had geleid.,waarschijnlijk goed,
9,Adverbial Modification,42,position_type,41,Ungrammatical,Quinty zag dat de manager goed waarschijnlijk had geleid.,goed waarschijnlijk,
9,Adverbial Modification,42,position_type,42,Grammatical,Rik hoorde dat de leerkracht blijkbaar geduldig was geweest.,blijkbaar geduldig,
9,Adverbial Modification,42,position_type,42,Ungrammatical,Rik hoorde dat de leerkracht geduldig blijkbaar was geweest.,geduldig blijkbaar,
9,Adverbial Modification,42,position_type,43,Grammatical,Sanne wist dat de chef ongetwijfeld goed had gekookt.,ongetwijfeld goed,
9,Adverbial Modification,42,position_type,43,Ungrammatical,Sanne wist dat de chef goed ongetwijfeld had gekookt.,goed ongetwijfeld,
9,Adverbial Modification,42,position_type,44,Grammatical,Ties zag dat de spreker waarschijnlijk boeiend had verteld.,waarschijnlijk boeiend,
9,Adverbial Modification,42,position_type,44,Ungrammatical,Ties zag dat de spreker boeiend waarschijnlijk had verteld.,boeiend waarschijnlijk,
9,Adverbial Modification,42,position_type,45,Grammatical,Ulla hoorde dat de muzikant zeker enthousiast had gespeeld.,zeker enthousiast,
9,Adverbial Modification,42,position_type,45,Ungrammatical,Ulla hoorde dat de muzikant enthousiast zeker had gespeeld.,enthousiast zeker,
9,Adverbial Modification,42,position_type,46,Grammatical,Victor wist dat de vriendin waarschijnlijk trots was geweest.,waarschijnlijk trots,
9,Adverbial Modification,42,position_type,46,Ungrammatical,Victor wist dat de vriendin trots waarschijnlijk was geweest.,trots waarschijnlijk,
9,Adverbial Modification,42,position_type,47,Grammatical,Wendy zag dat de leerling blijkbaar goed had opgelet.,blijkbaar goed,
9,Adverbial Modification,42,position_type,47,Ungrammatical,Wendy zag dat de leerling goed blijkbaar had opgelet.,goed blijkbaar,
9,Adverbial Modification,42,position_type,48,Grammatical,Xander hoorde dat de kok waarschijnlijk heerlijk had gekookt.,waarschijnlijk heerlijk,
9,Adverbial Modification,42,position_type,48,Ungrammatical,Xander hoorde dat de kok heerlijk waarschijnlijk had gekookt.,heerlijk waarschijnlijk,
9,Adverbial Modification,42,position_type,49,Grammatical,Yara wist dat de collega ongetwijfeld behulpzaam was geweest.,ongetwijfeld behulpzaam,
9,Adverbial Modification,42,position_type,49,Ungrammatical,ara wist dat de collega behulpzaam ongetwijfeld was geweest.,behulpzaam ongetwijfeld,
9,Adverbial Modification,42,position_type,50,Grammatical,Zayn zag dat de chauffeur misschien snel had gereageerd.,misschien snel,
9,Adverbial Modification,42,position_type,50,Ungrammatical,Zayn zag dat de chauffeur snel misschien had gereageerd.,snel misschien,
9,Adverbial Modification,42,position_type,51,Grammatical,Anouk hoorde dat de zangeres waarschijnlijk prachtig had gezongen.,waarschijnlijk prachtig,
9,Adverbial Modification,42,position_type,51,Ungrammatical,Anouk hoorde dat de zangeres prachtig waarschijnlijk had gezongen.,prachtig waarschijnlijk,
9,Adverbial Modification,42,position_type,52,Grammatical,Bas wist dat de presentator ongetwijfeld grappig had gesproken.,ongetwijfeld grappig,
9,Adverbial Modification,42,position_type,52,Ungrammatical,Bas wist dat de presentator grappig ongetwijfeld had gesproken.,grappig ongetwijfeld,
9,Adverbial Modification,42,position_type,53,Grammatical,Daan hoorde dat de acteur blijkbaar goed had geacteerd.,blijkbaar goed,
9,Adverbial Modification,42,position_type,53,Ungrammatical,Daan hoorde dat de acteur goed blijkbaar had geacteerd.,goed blijkbaar,
9,Adverbial Modification,42,position_type,54,Grammatical,Finn zag dat de leerling blijkbaar goed had opgelet.,blijkbaar goed,
9,Adverbial Modification,42,position_type,54,Ungrammatical,Finn zag dat de leerling goed blijkbaar had opgelet.,goed blijkbaar,
9,Adverbial Modification,42,position_type,55,Grammatical,Hidde wist dat de vriendin waarschijnlijk trots was geweest.,waarschijnlijk trots,
9,Adverbial Modification,42,position_type,55,Ungrammatical,Hidde wist dat de vriendin trots waarschijnlijk was geweest.,trots waarschijnlijk,
9,Adverbial Modification,42,position_type,56,Grammatical,Inge zag dat de spreker waarschijnlijk boeiend had verteld.,waarschijnlijk boeiend,
9,Adverbial Modification,42,position_type,56,Ungrammatical,Inge zag dat de spreker boeiend waarschijnlijk had verteld.,boeiend waarschijnlijk,
9,Adverbial Modification,42,position_type,57,Grammatical,Jelle hoorde dat de muzikant zeker enthousiast had gespeeld.,zeker enthousiast,
9,Adverbial Modification,42,position_type,57,Ungrammatical,Jelle hoorde dat de muzikant enthousiast zeker had gespeeld.,enthousiast zeker,
9,Adverbial Modification,42,position_type,58,Grammatical,Maud hoorde dat de vriend waarschijnlijk eerlijk had verteld.,waarschijnlijk eerlijk,
9,Adverbial Modification,42,position_type,58,Ungrammatical,Maud hoorde dat de vriend eerlijk waarschijnlijk had verteld.,eerlijk waarschijnlijk,
9,Adverbial Modification,42,position_type,59,Grammatical,Olivia zag dat de atleet waarschijnlijk hard had getraind.,waarschijnlijk hard,
9,Adverbial Modification,42,position_type,59,Ungrammatical,Olivia zag dat de atleet hard waarschijnlijk had getraind.,hard waarschijnlijk,
9,Adverbial Modification,42,position_type,60,Grammatical,Pim hoorde dat de spreker ongetwijfeld interessant had gesproken.,ongetwijfeld interessant,
9,Adverbial Modification,42,position_type,60,Ungrammatical,Pim hoorde dat de spreker interessant ongetwijfeld had gesproken.,interessant ongetwijfeld,
9,Adverbial Modification,42,position_type,61,Grammatical,Quinn wist dat de vriendin waarschijnlijk behulpzaam was geweest.,waarschijnlijk behulpzaam,
9,Adverbial Modification,42,position_type,61,Ungrammatical,Quinn wist dat de vriendin behulpzaam waarschijnlijk was geweest.,behulpzaam waarschijnlijk,
9,Adverbial Modification,42,position_type,62,Grammatical,Rick zag dat de deelnemer blijkbaar goed had gepresteerd.,blijkbaar goed,
9,Adverbial Modification,42,position_type,62,Ungrammatical,Rick zag dat de deelnemer goed blijkbaar had gepresteerd.,goed blijkbaar,
9,Adverbial Modification,42,position_type,63,Grammatical,Zeno wist dat de vriendin waarschijnlijk trots was geweest.,waarschijnlijk trots,
9,Adverbial Modification,42,position_type,63,Ungrammatical,Zeno wist dat de vriendin trots waarschijnlijk was geweest.,trots waarschijnlijk,
9,Adverbial Modification,42,position_type,64,Grammatical,Kevin dacht dat zijn zus waarschijnlijk snel zou reageren.,waarschijnlijk snel,
9,Adverbial Modification,42,position_type,64,Ungrammatical,Kevin dacht dat zijn zus snel waarschijnlijk zou reageren.,snel waarschijnlijk,
9,Adverbial Modification,42,position_type,65,Grammatical,Laura wist dat haar vriend zeker goed kon koken.,zeker goed,
9,Adverbial Modification,42,position_type,65,Ungrammatical,Laura wist dat haar vriend goed zeker kon koken.,goed zeker,
9,Adverbial Modification,42,position_type,66,Grammatical,Martijn zag dat de hond blijkbaar enthousiast had gespeeld.,blijkbaar enthousiast,
9,Adverbial Modification,42,position_type,66,Ungrammatical,Martijn zag dat de hond enthousiast blijkbaar had gespeeld.,enthousiast blijkbaar,
9,Adverbial Modification,42,position_type,67,Grammatical,Nadia hoorde dat de muzikant ongetwijfeld mooi had gespeeld.,ongetwijfeld mooi,
9,Adverbial Modification,42,position_type,67,Ungrammatical,Nadia hoorde dat de muzikant mooi ongetwijfeld had gespeeld.,mooi ongetwijfeld,
9,Adverbial Modification,42,position_type,68,Grammatical,Oscar wist dat de acteur mogelijk snel beroemd zou worden.,mogelijk snel,
9,Adverbial Modification,42,position_type,68,Ungrammatical,Oscar wist dat de acteur snel mogelijk beroemd zou worden.,snel mogelijk,
9,Adverbial Modification,42,position_type,69,Grammatical,Petra zag dat de rivier duidelijk snel stroomde.,duidelijk snel,
9,Adverbial Modification,42,position_type,69,Ungrammatical,Petra zag dat de rivier snel duidelijk stroomde.,snel duidelijk,
9,Adverbial Modification,42,position_type,70,Grammatical,Quincy hoorde dat de vogels waarschijnlijk luid zouden zingen.,waarschijnlijk luid,
9,Adverbial Modification,42,position_type,70,Ungrammatical,Quincy hoorde dat de vogels luid waarschijnlijk zouden zingen.,luid waarschijnlijk,
9,Adverbial Modification,42,position_type,71,Grammatical,Robin wist dat de klant misschien ontevreden zou zijn.,misschien ontevreden,
9,Adverbial Modification,42,position_type,71,Ungrammatical,Robin wist dat de klant ontevreden misschien zou zijn.,ontevreden misschien,
9,Adverbial Modification,42,position_type,72,Grammatical,Sanne zag dat de zon zeker fel scheen.,zeker fel,
9,Adverbial Modification,42,position_type,72,Ungrammatical,Sanne zag dat de zon fel zeker scheen.,fel zeker,
9,Adverbial Modification,42,position_type,73,Grammatical,Thijs hoorde dat de auto blijkbaar snel was gereden.,blijkbaar snel,
9,Adverbial Modification,42,position_type,73,Ungrammatical,Thijs hoorde dat de auto snel blijkbaar was gereden.,snel blijkbaar,
9,Adverbial Modification,42,position_type,74,Grammatical,Ursula wist dat de kat mogelijk stiekem had gesnoept.,mogelijk stiekem,
9,Adverbial Modification,42,position_type,74,Ungrammatical,Ursula wist dat de kat stiekem mogelijk had gesnoept.,stiekem mogelijk,
9,Adverbial Modification,42,position_type,75,Grammatical,Victor zag dat de boom waarschijnlijk oud was.,waarschijnlijk oud,
9,Adverbial Modification,42,position_type,75,Ungrammatical,Victor zag dat de boom oud waarschijnlijk was.,oud waarschijnlijk,
9,Adverbial Modification,42,position_type,76,Grammatical,Wendy hoorde dat de regen ongetwijfeld hard zou vallen.,ongetwijfeld hard,
9,Adverbial Modification,42,position_type,76,Ungrammatical,Wendy hoorde dat de regen hard ongetwijfeld zou vallen.,hard ongetwijfeld,
9,Adverbial Modification,42,position_type,77,Grammatical,Xavier wist dat de chef zeker tevreden was.,zeker tevreden,
9,Adverbial Modification,42,position_type,77,Ungrammatical,Xavier wist dat de chef tevreden zeker was.,tevreden zeker,
9,Adverbial Modification,42,position_type,78,Grammatical,Yara zag dat de bloemen blijkbaar mooi waren opgemaakt.,blijkbaar mooi,
9,Adverbial Modification,42,position_type,78,Ungrammatical,Yara zag dat de bloemen mooi blijkbaar waren opgemaakt.,mooi blijkbaar,
9,Adverbial Modification,42,position_type,79,Grammatical,Zoltan hoorde dat de klok waarschijnlijk langzaam tikte.,waarschijnlijk langzaam,
9,Adverbial Modification,42,position_type,79,Ungrammatical,Zoltan hoorde dat de klok langzaam waarschijnlijk tikte.,langzaam waarschijnlijk,
9,Adverbial Modification,42,position_type,80,Grammatical,Aaron wist dat de film misschien spannend zou eindigen.,misschien spannend,
9,Adverbial Modification,42,position_type,80,Ungrammatical,Aaron wist dat de film spannend misschien zou eindigen.,spannend misschien,
9,Adverbial Modification,42,position_type,81,Grammatical,Danielle wist dat de geur zeker aangenaam was.,zeker aangenaam,
9,Adverbial Modification,42,position_type,81,Ungrammatical,Danielle wist dat de geur aangenaam zeker was.,aangenaam zeker,
9,Adverbial Modification,42,position_type,82,Grammatical,Chris hoorde dat de atleet waarschijnlijk snel zou rennen.,waarschijnlijk snel,
9,Adverbial Modification,42,position_type,82,Ungrammatical,Chris hoorde dat de atleet snel waarschijnlijk zou rennen.,snel waarschijnlijk,
9,Adverbial Modification,42,position_type,83,Grammatical,Esmee zag dat de schilder blijkbaar talentvol was.,blijkbaar talentvol,
9,Adverbial Modification,42,position_type,83,Ungrammatical,Esmee zag dat de schilder talentvol blijkbaar was.,talentvol blijkbaar,
9,Adverbial Modification,42,position_type,84,Grammatical,Gina wist dat de zangeres zeker goed kon zingen.,zeker goed,
9,Adverbial Modification,42,position_type,84,Ungrammatical,Gina wist dat de zangeres goed zeker kon zingen.,goed zeker,
9,Adverbial Modification,42,position_type,85,Grammatical,Hendrik zag dat de hond blijkbaar enthousiast had gereageerd.,blijkbaar enthousiast,
9,Adverbial Modification,42,position_type,85,Ungrammatical,Hendrik zag dat de hond enthousiast blijkbaar had gereageerd.,enthousiast blijkbaar,
9,Adverbial Modification,42,position_type,86,Grammatical,Ingrid hoorde dat de baby waarschijnlijk rustig zou slapen.,waarschijnlijk rustig,
9,Adverbial Modification,42,position_type,86,Ungrammatical,Ingrid hoorde dat de baby rustig waarschijnlijk zou slapen.,rustig waarschijnlijk,
9,Adverbial Modification,42,position_type,87,Grammatical,Jeroen wist dat de computer zeker snel zou opstarten.,zeker snel,
9,Adverbial Modification,42,position_type,87,Ungrammatical,Jeroen wist dat de computer snel zeker zou opstarten.,snel zeker,
9,Adverbial Modification,42,position_type,88,Grammatical,Karlijn hoorde dat de monteur waarschijnlijk snel het probleem zou oplossen.,waarschijnlijk snel,
9,Adverbial Modification,42,position_type,88,Ungrammatical,Karlijn hoorde dat de monteur snel waarschijnlijk het probleem zou oplossen.,snel waarschijnlijk,
9,Adverbial Modification,42,position_type,89,Grammatical,Lars wist dat de actrice zeker goed had gepresteerd.,zeker goed,
9,Adverbial Modification,42,position_type,89,Ungrammatical,Lars wist dat de actrice goed zeker had gepresteerd.,goed zeker,
9,Adverbial Modification,42,position_type,90,Grammatical,Noud hoorde dat de regisseur waarschijnlijk snel zou beslissen.,waarschijnlijk snel,
9,Adverbial Modification,42,position_type,90,Ungrammatical,Noud hoorde dat de regisseur snel waarschijnlijk zou beslissen.,snel waarschijnlijk,
9,Adverbial Modification,42,position_type,91,Grammatical,Olivia wist dat de presentatie zeker boeiend zou zijn.,zeker boeiend,
9,Adverbial Modification,42,position_type,91,Ungrammatical,Olivia wist dat de presentatie boeiend zeker zou zijn.,boeiend zeker,
9,Adverbial Modification,42,position_type,92,Grammatical,Pieter zag dat de bezoeker blijkbaar verdwaald was.,blijkbaar verdwaald,
9,Adverbial Modification,42,position_type,92,Ungrammatical,Pieter zag dat de bezoeker verdwaald blijkbaar was.,verdwaald blijkbaar,
9,Adverbial Modification,42,position_type,93,Grammatical,Quinty hoorde dat de kok waarschijnlijk smakelijk zou koken.,waarschijnlijk smakelijk,
9,Adverbial Modification,42,position_type,93,Ungrammatical,Quinty hoorde dat de kok smakelijk waarschijnlijk zou koken.,smakelijk waarschijnlijk,
9,Adverbial Modification,42,position_type,94,Grammatical,Renske wist dat de spreker zeker duidelijk zou uitleggen.,zeker duidelijk,
9,Adverbial Modification,42,position_type,94,Ungrammatical,Renske wist dat de spreker duidelijk zeker zou uitleggen.,duidelijk zeker,
9,Adverbial Modification,42,position_type,95,Grammatical,Sander zag dat de rivier blijkbaar diep was.,blijkbaar diep,
