id	label	sentence_bad	source	category	type	subcat	sentence_good	commentaire
1380	0	Notre partenariat remonte a quatre ou cinq ans.	https://vitrinelinguistique.oqlf.gouv.qc.ca/21101/la-syntaxe/les-prepositions/preposition-devant-un-nom/repetition-des-prepositions-obligatoire-facultative-ou-omise	syntax	4.0		Notre partenariat remonte à il y a quatre ou cinq ans.	
1408	0	Nous lui avons demandé d’élaborer sur sa décision.	https://vitrinelinguistique.oqlf.gouv.qc.ca/21197/les-emprunts-a-langlais/emprunts-semantiques/emploi-deconseille-de-lemprunt-elaborer	anglicism	4.0		Nous lui avons demandé d’élaborer sa décision.	
1478	0	Peut-être que chercherai-je un nouvel emploi.	https://vitrinelinguistique.oqlf.gouv.qc.ca/23472/la-syntaxe/le-sujet-dans-la-phrase/inversion-sujet-verbe-apres-des-adverbes-comme-peut-etre-en-tete-de-phrase	syntax	4.0		Peut-être chercherai-je un nouvel emploi.	
1493	0	Plusieurs employés de l’entreprise lorgnent sur le poste de gestionnaire.	https://vitrinelinguistique.oqlf.gouv.qc.ca/23644/la-syntaxe/les-prepositions/preposition-apres-un-verbe/prepositions-deconseillees-apres-le-verbe-lorgner	syntax	4.0		Plusieurs employés de l’entreprise lorgnent le poste de gestionnaire.	
1504	0	Pour certains, stationner sa voiture à reculant est un exercice difficile.	https://vitrinelinguistique.oqlf.gouv.qc.ca/24892/le-vocabulaire/tours-dhorizon-et-autres-explications/mises-au-point/les-locutions-a-reculons-et-de-reculons	semantic	4.0		Pour certains, stationner sa voiture en reculant est un exercice difficile.	
1505	0	Pour certains, stationner sa voiture de reculant est un exercice difficile.	https://vitrinelinguistique.oqlf.gouv.qc.ca/24892/le-vocabulaire/tours-dhorizon-et-autres-explications/mises-au-point/les-locutions-a-reculons-et-de-reculons	semantic	4.0		Pour certains, stationner sa voiture en reculant est un exercice difficile.	
1528	0	Pourriez-vous élaborer sur cette idée?	https://vitrinelinguistique.oqlf.gouv.qc.ca/21197/les-emprunts-a-langlais/emprunts-semantiques/emploi-deconseille-de-lemprunt-elaborer	anglicism	4.0		Pourriez-vous élaborer cette idée?	
1574	0	Sa demande aurait été acceptée, n’eût été de l’expiration du délai.	https://vitrinelinguistique.oqlf.gouv.qc.ca/24117/la-grammaire/le-verbe/accord-du-verbe-avec-le-sujet/cas-particuliers-daccord-du-verbe/accord-et-emploi-de-neut-ete-et-neussent-ete	morphology	4.0		Sa demande aurait été acceptée, n’eût été l’expiration du délai.	
1748	0	Vous pouvez prendre ma parole, j'ai terminé mon discours avant le temps.	https://vitrinelinguistique.oqlf.gouv.qc.ca/23612/les-emprunts-a-langlais/emprunts-syntaxiques/lexpression-deconseillee-prendre-la-parole-de-quelquun	anglicism	4.0		Vous pouvez prendre la parole, j'ai terminé mon discours avant le temps.	
420	0	Elles ce rappelèrent soudain qu’elles avaient promis de rentrer tôt.	https://vitrinelinguistique.oqlf.gouv.qc.ca/22440/la-grammaire/les-homophones-grammaticaux/les-homophones-ce-et-se	morphology	4.0		Elles se rappelèrent soudain qu’elles avaient promis de rentrer tôt.	
454	0	Enfant, il avait du mal à contenir s’est excès d’enthousiasme.	https://vitrinelinguistique.oqlf.gouv.qc.ca/25292/le-vocabulaire/paronymes/sens-et-emploi-de-acces-et-de-exces	semantic	4.0		Enfant, il avait du mal à contenir ses excès d’enthousiasme.	
592	0	Il partit, et se faisant, il indisposa tous les invités.	https://vitrinelinguistique.oqlf.gouv.qc.ca/22440/la-grammaire/les-homophones-grammaticaux/les-homophones-ce-et-se	morphology	4.0		Il partit, et ce faisant, il indisposa tous les invités.	
605	0	Il va s’en dire que les Québécois et les Québécoises seront encore obligés de pelleter cette année.	https://vitrinelinguistique.oqlf.gouv.qc.ca/24804/la-grammaire/les-homophones-grammaticaux/les-homophones-il-va-sans-dire-et-il-va-sen-dire	morphology	4.0		Il va sans dire que les Québécois et les Québécoises seront encore obligés de pelleter cette année.	
1500	0	Pour ce faire une bonne opinion de quelqu’un, il vaut mieux laisser passer les premiers instants.	https://vitrinelinguistique.oqlf.gouv.qc.ca/24802/la-grammaire/les-homophones-grammaticaux/les-homophones-ce-et-se-devant-le-verbe-faire	morphology	4.0		Pour se faire une bonne opinion de quelqu’un, il vaut mieux laisser passer les premiers instants.	
1501	0	Pour ce faire, l’activité devra bénéficier d’un temps clément.	https://vitrinelinguistique.oqlf.gouv.qc.ca/24802/la-grammaire/les-homophones-grammaticaux/les-homophones-ce-et-se-devant-le-verbe-faire	morphology	4.0		Pour se faire, l’activité devra bénéficier d’un temps clément.	
1609	0	Si ses notes le lui permettent, elle c’inscrira à l’université dès l’an prochain.	https://vitrinelinguistique.oqlf.gouv.qc.ca/22440/la-grammaire/les-homophones-grammaticaux/les-homophones-ce-et-se	morphology	4.0		Si ses notes le lui permettent, elle s’inscrira à l’université dès l’an prochain.	
149	0	Ce projet de relance a fait l’unanimité totale chez les cadres de l’entreprise.	https://vitrinelinguistique.oqlf.gouv.qc.ca/22141/le-vocabulaire/pleonasmes/les-pleonasmes-unanimite-totale-et-tous-unanimes	semantic	4.0		Ce projet de relance a fait l’unanimité chez les cadres de l’entreprise.	
329	0	Depuis sa célèbre chanson Quand j’aime une fois j’aime pour toujours, le succès de Richard Desjardins ne ce dément pas.	https://vitrinelinguistique.oqlf.gouv.qc.ca/24371/la-typographie/mise-en-relief/italique/emploi-de-litalique-pour-les-titres-doeuvres-et-de-publications-periodiques	syntax	4.0		Depuis sa célèbre chanson Quand j’aime une fois j’aime pour toujours, le succès de Richard Desjardins ne se dément pas.	
397	0	Elle fait tout pour éviter la moindre petite dépense.	https://vitrinelinguistique.oqlf.gouv.qc.ca/22164/le-vocabulaire/pleonasmes/le-pleonasme-le-moindre-petit	semantic	4.0		Elle fait tout pour éviter la moindre dépense.	
457	0	Entre le frère et la sœur règne une bienveillance réciproque de part et d’autre.	https://vitrinelinguistique.oqlf.gouv.qc.ca/22115/le-vocabulaire/pleonasmes/le-pleonasme-reciproque-de-part-et-dautre	semantic	4.0		Entre le frère et la sœur règne une bienveillance réciproque.	
1017	0	Le conférencier voulait nous partager son expérience de coopération internationale.	https://vitrinelinguistique.oqlf.gouv.qc.ca/22128/la-syntaxe/le-complement-du-verbe/partager-et-ses-complements	syntax	4.0		Le conférencier voulait partager avec nous son expérience de coopération internationale.	
1401	0	Nous établirons les dates de nos réunions dépendant de votre disponibilité.	https://vitrinelinguistique.oqlf.gouv.qc.ca/21047/les-emprunts-a-langlais/emprunts-syntaxiques/dependant-emplois-deconseilles-calques-sur-langlais	anglicism	4.0		Nous établirons les dates de nos réunions dépendamment de votre disponibilité.	
1410	0	Nous ne sommes pas au courant de la raison spécifique de son congédiement.	https://vitrinelinguistique.oqlf.gouv.qc.ca/25190/les-emprunts-a-langlais/emprunts-semantiques/emploi-deconseille-de-lemprunt-specifique	anglicism	4.0		Nous ne sommes pas mis au courant de la raison spécifique de son congédiement.	
1434	0	On juge souvent une personne d’après son apparence extérieure.	https://vitrinelinguistique.oqlf.gouv.qc.ca/21959/le-vocabulaire/pleonasmes/le-pleonasme-apparence-exterieure	semantic	4.0		On juge souvent une personne d’après son apparence.	
1630	0	Sophie a fait quelques erreurs involontaires dans sa thèse de doctorat.	https://vitrinelinguistique.oqlf.gouv.qc.ca/23875/le-vocabulaire/pleonasmes/le-pleonasme-erreur-involontaire	semantic	4.0		Sophie a fait quelques erreurs dans sa thèse de doctorat.	
2	0	« Merci pour m’avoir aidé à déménager. — De rien! »	https://vitrinelinguistique.oqlf.gouv.qc.ca/23889/le-vocabulaire/tours-dhorizon-et-autres-explications/tours-dhorizon/emploi-et-sens-dexpressions-composees-avec-rien	semantic	4.0		« Merci de m’avoir aidé à déménager. — De rien! »	
15	0	Accepteriez-vous de souscrire un abonnement à notre magazine?	https://vitrinelinguistique.oqlf.gouv.qc.ca/23657/la-syntaxe/le-complement-du-verbe/souscrire-et-ses-complements	syntax	4.0		Accepteriez-vous de souscrire à un abonnement à notre magazine?	
21	0	Ainsi donc mon amour m'était récompensé.	https://vitrinelinguistique.oqlf.gouv.qc.ca/25253/le-vocabulaire/tours-dhorizon-et-autres-explications/mises-au-point/les-constructions-ainsi-donc-et-ainsi-par-exemple	semantic	4.0		Ainsi donc mon amour était récompensé.	
59	0	Autant en finir maintenant que remettre cela à plus tard.	https://vitrinelinguistique.oqlf.gouv.qc.ca/23892/la-syntaxe/les-prepositions/preposition-devant-un-infinitif/la-preposition-de-apres-que-dans-les-comparaisons-avec-un-verbe-a-linfinitif	syntax	4.0		Autant en finir maintenant que de remettre cela à plus tard.	
63	0	Avant le retour en classe, l’enseignant passe beaucoup de temps à la projeter.	https://vitrinelinguistique.oqlf.gouv.qc.ca/24536/la-syntaxe/le-complement-du-verbe/projeter-avec-ou-sans-complement	syntax	4.0		Avant le retour en classe, l’enseignant passe beaucoup de temps à projeter.	
90	0	C’est pourquoi que l’Atelier de nettoyage Sinet vous donnera satisfaction.	https://vitrinelinguistique.oqlf.gouv.qc.ca/23393/la-grammaire/le-verbe/accord-du-verbe-avec-le-sujet/cas-particuliers-daccord-du-verbe/accord-du-verbe-avec-un-nom-dentreprise	morphology	4.0		C’est pourquoi l’Atelier de nettoyage Sinet vous donnera satisfaction.	
115	0	Ce documentaire laisse préjuger les opinions politiques de son auteur.	https://vitrinelinguistique.oqlf.gouv.qc.ca/24299/la-syntaxe/le-complement-du-verbe/prejuger-et-ses-complements	syntax	4.0		Ce documentaire laisse préjuger des opinions politiques de son auteur.	
121	0	C'est le genre d’appareil est très pratique.	https://vitrinelinguistique.oqlf.gouv.qc.ca/22743/la-grammaire/le-verbe/accord-du-verbe-avec-le-sujet/sujet-qui-est-un-nom-collectif/nombre-du-nom-suivant-genre-de-ou-espece-de-et-accord-du-verbe	morphology	4.0		C'est le genre d’appareil qui est très pratique.	
209	0	Cet athlète a priorisé ses études plutôt que viser une médaille au prochain championnat mondial.	https://vitrinelinguistique.oqlf.gouv.qc.ca/23800/les-emprunts-a-langlais/emprunts-morphologiques/les-emprunts-acceptes-prioriser-et-priorisation	anglicism	4.0		Cet athlète a priorisé ses études plutôt que de viser une médaille au prochain championnat mondial.	
210	0	Cet athlète n’a pas échoué à son test antidopage.	https://vitrinelinguistique.oqlf.gouv.qc.ca/23882/la-syntaxe/le-complement-du-verbe/echouer-avec-ou-sans-complement	syntax	4.0		Cet athlète n’a pas échoué à son test d’antidopage.	
216	0	Cet homme cherche à que l’art le console.	https://vitrinelinguistique.oqlf.gouv.qc.ca/25221/la-syntaxe/le-complement-du-verbe/subordonnee-completive-introduite-par-que-a-ce-que-et-de-ce-que	syntax	4.0		Cet homme cherche à ce que l’art le console.	
228	0	Cette année difficile ternie avec un divorce et un déménagement s’est terminée par la perte de son emploi.	https://vitrinelinguistique.oqlf.gouv.qc.ca/24454/le-vocabulaire/alterations-dexpressions-figees/les-expressions-la-cerise-sur-le-gateau-et-la-cerise-sur-le-sundae	semantic	4.0		Cette année difficile ternie par un divorce et un déménagement s’est terminée par la perte de son emploi.	
235	0	Cette chemise rouge à carreaux détonne d'avec ces pantalons rayés bleu et blanc.	https://vitrinelinguistique.oqlf.gouv.qc.ca/24673/lorthographe/homophones-lexicaux/les-homophones-detoner-et-detonner	morphology	4.0		Cette chemise rouge à carreaux détonne avec ces pantalons rayés bleu et blanc.	
355	0	Donnes-en lui en échange.	https://vitrinelinguistique.oqlf.gouv.qc.ca/22512/la-prononciation/prononciation-de-certaines-lettres/emploi-du-s-euphonique	morphology	4.0		Donnes-lui en en échange.	
388	0	Elle est considérée comme étant une excellente candidate sur ce poste.	https://vitrinelinguistique.oqlf.gouv.qc.ca/23774/le-vocabulaire/tours-dhorizon-et-autres-explications/mises-au-point/emploi-de-comme-etant	semantic	4.0		Elle est considérée comme étant une excellente candidate à ce poste.	
389	0	Elle est heureuse que pouvoir enfin vivre de sa plume.	https://vitrinelinguistique.oqlf.gouv.qc.ca/23895/la-syntaxe/les-prepositions/preposition-apres-un-verbe/prepositions-a-employer-apres-le-verbe-vivre	syntax	4.0		Elle est heureuse de pouvoir enfin vivre de sa plume.	
459	0	Envoyez-m’y quelques-uns.	https://vitrinelinguistique.oqlf.gouv.qc.ca/23513/la-grammaire/les-pronoms/pronoms-personnels/le-pronom-personnel-en	morphology	4.0		Envoyez-m’en quelques-uns.	
460	0	Épuisée, je me suis tombé sur le lit.	https://vitrinelinguistique.oqlf.gouv.qc.ca/21711/la-grammaire/le-verbe/accord-du-participe-passe/cas-particuliers-daccord-du-participe-passe/accord-du-participe-passe-laisse-suivi-dun-infinitif	morphology	4.0		Épuisée, je suis tombé sur le lit.	
462	0	Est-ce lui qui montera en l’échelle?	https://vitrinelinguistique.oqlf.gouv.qc.ca/24292/la-syntaxe/les-prepositions/preposition-devant-un-nom/les-prepositions-a-de-dans-et-sur-devant-echelle	syntax	4.0		Est-ce lui qui montera sur l’échelle?	
463	0	Est-ce que vous avez bien reçu de notre rapport?	https://vitrinelinguistique.oqlf.gouv.qc.ca/23383/la-ponctuation/point-dinterrogation/phrase-interrogative-et-emploi-du-point-dinterrogation	syntax	4.0		Est-ce que vous avez bien reçu notre rapport?	
464	0	Estelle aimerait bien acheter un appareil photographique avant que partir en voyage.	https://vitrinelinguistique.oqlf.gouv.qc.ca/23138/lorthographe/emploi-du-trait-dunion/mots-composes/mots-composes-avec-prefixe-ou-element-grec-ou-latin/trait-dunion-ou-soudure-avec-lelement-photo8215	morphology	4.0		Estelle aimerait bien acheter un appareil photographique avant de partir en voyage.	
465	0	Esther a économisé jusqu’à maintenant près de 20 000 dollars pour acheter une maison à elle-même.	https://vitrinelinguistique.oqlf.gouv.qc.ca/24318/la-syntaxe/les-prepositions/preposition-devant-un-nom/la-preposition-jusque	syntax	4.0		Esther a économisé jusqu’à maintenant près de 20 000 dollars pour s’acheter une maison.	
467	0	Eugène voulait absolument qu'il est le meilleur – (c’était évident) – mais il n’obtint que le deuxième rang.	https://vitrinelinguistique.oqlf.gouv.qc.ca/23376/la-ponctuation/tiret/divers-emplois-du-tiret	syntax	4.0		Eugène voulait absolument être le meilleur – (c’était évident) – mais il n’obtint que le deuxième rang.	
468	0	Éva a sous-évalué les délais sur la rénovation de la cuisine.	https://vitrinelinguistique.oqlf.gouv.qc.ca/23115/lorthographe/emploi-du-trait-dunion/mots-composes/mots-composes-avec-preposition-ou-adverbe/emploi-du-trait-dunion-dans-les-mots-composes-avec-sous	morphology	4.0		Éva a sous-évalué les délais pour la rénovation de la cuisine.	
470	0	Faire magasinage est sans contredit son activité de prédilection.	https://vitrinelinguistique.oqlf.gouv.qc.ca/23637/le-vocabulaire/tours-dhorizon-et-autres-explications/tours-dhorizon/emploi-et-sens-de-magasiner-et-de-magasinage	semantic	4.0		Faire du magasinage est sans contredit son activité de prédilection.	
472	0	Félix a finalement pris de les devants en invitant Émilie au cinéma.	https://vitrinelinguistique.oqlf.gouv.qc.ca/24376/la-grammaire/le-nom/nombre-des-noms-dans-certains-emplois/cas-particuliers-du-nombre-du-nom/singulier-et-pluriel-des-mots-occasionnellement-employes-comme-noms	morphology	4.0		Félix a finalement pris les devants en invitant Émilie au cinéma.	
473	0	Finalement, ce qui importe, c’est savoir de ce que l’on veut.	https://vitrinelinguistique.oqlf.gouv.qc.ca/22614/les-emprunts-a-langlais/emprunts-idiomatiques/lemprunt-deconseille-a-la-fin-de-la-journee	anglicism	4.0		Finalement, ce qui importe, c’est de savoir ce que l’on veut.	
474	0	Fondé en 1974, le Grand Conseil des Cris représente de plusieurs communautés cries du Nord-du-Québec.	https://vitrinelinguistique.oqlf.gouv.qc.ca/21529/la-typographie/majuscules/emploi-de-la-majuscule-pour-des-types-de-denominations/majuscule-aux-noms-dorganismes-uniques-dans-un-etat	syntax	4.0		Fondé en 1974, le Grand Conseil des Cris représente plusieurs communautés cries du Nord-du-Québec.	
475	0	For Honor est un jeu comportant à trois factions : les Chevaliers, les Vikings et les Samouraïs.	https://vitrinelinguistique.oqlf.gouv.qc.ca/25288/la-typographie/mise-en-relief/italique/emploi-de-litalique-pour-les-titres-de-jeux-video	syntax	4.0		For Honor est un jeu comportant trois factions : les Chevaliers, les Vikings et les Samouraïs.	
476	0	Francine est fascinée avec les arcs-en-ciel.	https://vitrinelinguistique.oqlf.gouv.qc.ca/23552/la-prononciation/liaisons/contextes-de-liaisons-interdites	morphology	4.0		Francine est fascinée par les arcs-en-ciel.	
477	0	François a adoré passer l’été à Venise, bien que les frais de logement en soient considérables.	https://vitrinelinguistique.oqlf.gouv.qc.ca/22007/le-vocabulaire/pleonasmes/le-pleonasme-frais-onereux	semantic	4.0		François a adoré passer l’été à Venise, bien que les frais de logement y soient considérables.	
478	0	François s’est enfin décidé de quitter cet emploi où il piétinait depuis trop longtemps.	https://vitrinelinguistique.oqlf.gouv.qc.ca/22181/le-vocabulaire/pleonasmes/le-pleonasme-pietiner-sur-place	semantic	4.0		François s’est enfin décidé à quitter cet emploi où il piétinait depuis trop longtemps.	
479	0	François est inscrit trois séances de gymnastique de deux heures et demie par semaine.	https://vitrinelinguistique.oqlf.gouv.qc.ca/21752/la-grammaire/ladjectif/accord-de-ladjectif/cas-particuliers-daccord-de-ladjectif/emploi-adjectival-et-adverbial-de-demi	morphology	4.0		François est inscrit à trois séances de gymnastique de deux heures et demie par semaine.	
480	0	Gatineau est un chef de file dans matière de développement économique.	https://vitrinelinguistique.oqlf.gouv.qc.ca/21608/la-grammaire/le-nom/genre-des-noms/genre-des-noms-de-villes	morphology	4.0		Gatineau est un chef de file en matière de développement économique.	
481	0	Gertrude a commencé de travailler pour son employeur en 1998.	https://vitrinelinguistique.oqlf.gouv.qc.ca/24218/la-grammaire/le-verbe/temps-grammaticaux/passe/generalites-sur-le-passe-compose	morphology	4.0		Gertrude a commencé à travailler pour son employeur en 1998.	
482	0	Grand solde d’appareils ménagers : rabais pouvant qu'ils aillent jusqu’à 50 % du prix de catalogue!	https://vitrinelinguistique.oqlf.gouv.qc.ca/22368/les-emprunts-a-langlais/emprunts-morphologiques/les-emprunts-deconseilles-prix-de-liste-et-prix-regulier	anglicism	4.0		Grand solde d’appareils ménagers : rabais pouvant aller jusqu’à 50 % du prix de catalogue!	
483	0	Ha! vous n’étiez pas déjà ça?!	https://vitrinelinguistique.oqlf.gouv.qc.ca/23718/lorthographe/homophones-lexicaux/les-homophones-ah-et-ha	morphology	4.0		Ha! vous ne l’étiez pas déjà?!	
484	0	Harold a visité au Musée de l’Artillerie royale canadienne.	https://vitrinelinguistique.oqlf.gouv.qc.ca/24430/la-typographie/majuscules/emploi-de-la-majuscule-pour-des-types-de-denominations/majuscule-aux-noms-dunites-militaires	syntax	4.0		Harold a visité le Musée de l’Artillerie royale canadienne.	
485	0	Hélène a déjà participé un tournoi.	https://vitrinelinguistique.oqlf.gouv.qc.ca/23510/la-grammaire/ladverbe/ladverbe-deja	morphology	4.0		Hélène a déjà participé à un tournoi.	
486	0	Hélène et Julie mangent un restaurant ce midi.	https://vitrinelinguistique.oqlf.gouv.qc.ca/23446/la-ponctuation/virgule/la-virgule-avec-la-conjonction-et	syntax	4.0		Hélène et Julie mangent au restaurant ce midi.	
487	0	Hélène et Martine s’aident mutuellement en leur travail.	https://vitrinelinguistique.oqlf.gouv.qc.ca/22955/la-grammaire/le-verbe/verbes-pronominaux/verbe-pronominal-de-sens-reciproque	morphology	4.0		Hélène et Martine s’aident mutuellement dans leur travail.	
489	0	Heureusement avec elle, on a diagnostiqué son ostéoporose.	https://vitrinelinguistique.oqlf.gouv.qc.ca/24632/la-syntaxe/le-complement-du-verbe/diagnostiquer-et-ses-complements	syntax	4.0		Heureusement pour elle, on a diagnostiqué son ostéoporose très tôt.	
490	0	Heureusement, le sac est petit, car ces croustilles goûtent vraiment à quelque chose d’irrésistible.	https://vitrinelinguistique.oqlf.gouv.qc.ca/25312/les-emprunts-a-langlais/emprunts-hybrides/lemprunt-deconseille-addictif	anglicism	4.0		Heureusement, le sac est petit, car ces croustilles goûtent vraiment quelque chose d’irrésistible.	
491	0	Heureuses de vous compter jusqu'à nous.	https://vitrinelinguistique.oqlf.gouv.qc.ca/25286/la-grammaire/ladjectif/accord-de-ladjectif/cas-particuliers-daccord-de-ladjectif-en-phrase/accord-des-adjectifs-en-tete-de-phrase	morphology	4.0		Heureuses de vous compter parmi nous.	
492	0	Hier, mon fils est sorti par ses meilleurs amis.	https://vitrinelinguistique.oqlf.gouv.qc.ca/22949/la-grammaire/la-grammaire-actuelle/la-phrase/phrase-a-la-forme-active	morphology	4.0		Hier, mon fils est sorti avec ses meilleurs amis.	
493	0	Hugo habite en la Suisse depuis déjà trois ans.	https://vitrinelinguistique.oqlf.gouv.qc.ca/22127/la-syntaxe/les-prepositions/preposition-apres-un-verbe/prepositions-a-employer-apres-le-verbe-habiter	syntax	4.0		Hugo habite la Suisse depuis déjà trois ans.	
494	0	Il a commandé pour une caisse d'oranges californiennes.	https://vitrinelinguistique.oqlf.gouv.qc.ca/21099/la-grammaire/ladjectif/accord-de-ladjectif/cas-particuliers-daccord-de-ladjectif-en-phrase/accord-de-ladjectif-apres-un-complement-du-nom	morphology	4.0		Il a commandé une caisse d'oranges californiennes.	
495	0	Il a commencé à s’intéresser sur l’ornithologie dès l’adolescence.	https://vitrinelinguistique.oqlf.gouv.qc.ca/23477/la-syntaxe/les-prepositions/preposition-devant-un-nom/la-preposition-des	syntax	4.0		Il a commencé à s’intéresser à l’ornithologie dès l’adolescence.	
496	0	Il a décidé de vivre intensément et de profiter chaque instant.	https://vitrinelinguistique.oqlf.gouv.qc.ca/24487/le-vocabulaire/nuances-semantiques/difference-entre-intense-et-intensif	semantic	4.0		Il a décidé de vivre intensément et de profiter de chaque instant.	
497	0	Il a employé l’expression « mettre la charru en avant les bœufs ».	https://vitrinelinguistique.oqlf.gouv.qc.ca/23375/la-ponctuation/guillemets/guillemets-et-citation	syntax	4.0		Il a employé l’expression « mettre la charrue avant les bœufs ».	
498	0	Il a endossé avec sa veste et il est parti sans dire un mot.	https://vitrinelinguistique.oqlf.gouv.qc.ca/21996/les-emprunts-a-langlais/emprunts-semantiques/emploi-deconseille-de-lemprunt-endosser	anglicism	4.0		Il a endossé sa veste et il est parti sans dire un mot.	
499	0	Il a enfin déterminé l’objet que sa recherche.	https://vitrinelinguistique.oqlf.gouv.qc.ca/23565/les-emprunts-a-langlais/emprunts-integraux/lemprunt-deconseille-focus	anglicism	4.0		Il a enfin déterminé l’objet de sa recherche.	
501	0	Il a eu gain de cause, et ce, sans se brouiller sur ses collègues.	https://vitrinelinguistique.oqlf.gouv.qc.ca/22328/les-emprunts-a-langlais/emprunts-syntaxiques/les-expressions-deconseillees-faire-son-point-et-gagner-son-point	anglicism	4.0		Il a eu gain de cause, et ce, sans se brouiller avec ses collègues.	
502	0	Il a fait preuve d’une volonté sans pareille en ce projet ambitieux.	https://vitrinelinguistique.oqlf.gouv.qc.ca/22889/la-grammaire/le-nom/pluriel-des-noms/noms-dans-les-expressions-figees/expressions-formees-avec-le-mot-pareil	morphology	4.0		Il a fait preuve d’une volonté sans pareille dans ce projet ambitieux.	
503	0	Il a inscrit ton nom en lieu du mien; c’est probablement une faute d’inattention.	https://vitrinelinguistique.oqlf.gouv.qc.ca/23929/le-vocabulaire/improprietes/faute-dattention-impropriete-et-emplois-corrects	semantic	4.0		Il a inscrit ton nom au lieu du mien; c’est probablement une faute d’inattention.	
504	0	Il a lu les œuvres complètes de Voltaire pour écrire avec ce sujet.	https://vitrinelinguistique.oqlf.gouv.qc.ca/23467/la-grammaire/le-nom/genre-des-noms/genre-du-nom-oeuvre	morphology	4.0		Il a lu les œuvres complètes de Voltaire pour écrire sur ce sujet.	
505	0	Il a manqué tenir à sa promesse.	https://vitrinelinguistique.oqlf.gouv.qc.ca/24314/la-syntaxe/les-prepositions/preposition-apres-un-verbe/prepositions-a-employer-apres-le-verbe-manquer	syntax	4.0		Il a manqué à tenir à sa promesse.	
506	0	Il a obtenu pour une promotion et nous en sommes tous fort aises.	https://vitrinelinguistique.oqlf.gouv.qc.ca/21032/la-grammaire/ladjectif/adjectif-employe-comme-adverbe/fort-employe-comme-adjectif-ou-adverbe	morphology	4.0		Il a obtenu une promotion et nous en sommes tous fort aises.	
507	0	Il a parié à réussir tous ses cours de la session.	https://vitrinelinguistique.oqlf.gouv.qc.ca/24567/la-syntaxe/le-complement-du-verbe/parier-et-ses-complements	syntax	4.0		Il a parié réussir tous ses cours de la session.	
508	0	Il a payé cher sa récente promotion : il a dû quitter avec ses proches et la ville où il a grandi.	https://vitrinelinguistique.oqlf.gouv.qc.ca/23782/lorthographe/homophones-lexicaux/les-homophones-chair-chaire-cher-et-chere	morphology	4.0		Il a payé cher sa récente promotion : il a dû quitter ses proches et la ville où il a grandi.	
510	0	Il a produit un rapport non équivoque sur lequel nous nous appuierons de prendre une décision.	https://vitrinelinguistique.oqlf.gouv.qc.ca/22459/les-emprunts-a-langlais/emprunts-semantiques/emploi-deconseille-des-emprunts-candide-et-candidement	anglicism	4.0		Il a produit un rapport non équivoque sur lequel nous nous appuierons pour prendre une décision.	
