id	label	sentence_bad	source	category	type	subcat	sentence_good	commentaire
948	0	La mononucléose est une maladie dont parle les spécialistes comme étant particulièrement prompte à n'affecter pas les adultes.	https://vitrinelinguistique.oqlf.gouv.qc.ca/23119/lorthographe/emploi-du-trait-dunion/mots-composes/mots-composes-avec-prefixe-ou-element-grec-ou-latin/trait-dunion-ou-soudure-avec-lelement-mono8209	morphology	5.0		La mononucléose est une maladie dont parle les spécialistes comme étant particulièrement prompte à ne pas affecter les adultes.	b
953	0	La novice a tenu à n'abandonner pas malgré la domination exercée par la championne en titre.	https://vitrinelinguistique.oqlf.gouv.qc.ca/25274/le-vocabulaire/nuances-semantiques/difference-entre-faire-long-feu-et-ne-pas-faire-long-feu	semantic	5.0		La novice a tenu à ne pas abandonner malgré la domination exercée par la championne en titre.	b
956	0	La peintre avait tout de même tenté de ne réduire pas l’éclat et les délicatesses de la lumière.	https://vitrinelinguistique.oqlf.gouv.qc.ca/23882/la-syntaxe/le-complement-du-verbe/echouer-avec-ou-sans-complement	syntax	5.0		La peintre avait tout de même tenté de ne pas réduire l’éclat et les délicatesses de la lumière.	b
957	0	La luxure est un bon moyen de ne conserver pas ses capacités de concentration.	https://vitrinelinguistique.oqlf.gouv.qc.ca/24065/les-emprunts-a-langlais/emprunts-semantiques/emploi-deconseille-des-emprunts-pratiquer-et-pratique	anglicism	5.0		La luxure est un bon moyen de ne pas conserver ses capacités de concentration.	b
960	0	La plupart des jeunes adultes, aujourd’hui, aime mieux ne posséder pas de voiture.	https://vitrinelinguistique.oqlf.gouv.qc.ca/23405/la-ponctuation/virgule/la-virgule-et-les-complements-de-phrase	syntax	5.0		La plupart des jeunes adultes, aujourd’hui, aime mieux ne pas posséder pas.	b
962	0	La police croit que l’incendie d’hier aurait pu n'être pas si dommageable.	https://vitrinelinguistique.oqlf.gouv.qc.ca/23284/le-vocabulaire/nuances-semantiques/difference-entre-pyromane-et-incendiaire	semantic	5.0		La police croit que l’incendie d’hier aurait pu ne pas être si dommageable.	b
963	0	La policière a donné une contravention à un automobiliste qui essayait malgré tout de ne bloquer pas la circulation.	https://vitrinelinguistique.oqlf.gouv.qc.ca/24076/les-emprunts-a-langlais/emprunts-semantiques/emploi-deconseille-de-lemprunt-emettre	anglicism	5.0		La policière a donné une contravention à un automobiliste qui essayait malgré tout de ne pas bloquer la circulation.	b
964	0	On recommande à la population de ne manquer pas la rencontre du Conseil de la Première Nation des Innus Essipit.	https://vitrinelinguistique.oqlf.gouv.qc.ca/25335/la-typographie/majuscules/emploi-de-la-majuscule-pour-des-types-de-denominations/designations-de-peuples-autochtones	syntax	5.0		On recommande à la population de ne pas manquer la rencontre du Conseil de la Première Nation des Innus Essipit.	b
966	0	La poste canadienne a pour mission de n'oublier pas d'émettre régulièrement de nouveaux timbres.	https://vitrinelinguistique.oqlf.gouv.qc.ca/24076/les-emprunts-a-langlais/emprunts-semantiques/emploi-deconseille-de-lemprunt-emettre	anglicism	5.0		La poste canadienne a pour mission de ne pas oublier d'émettre régulièrement de nouveaux timbres.	b
968	0	La seule chose à ne faire pas, c’est éteindre l’ordinateur.	https://vitrinelinguistique.oqlf.gouv.qc.ca/23808/le-vocabulaire/tours-dhorizon-et-autres-explications/usages/emploi-de-ouvrir-et-fermer	semantic	5.0		La seule chose à ne pas faire, c’est éteindre l’ordinateur.	b
969	0	La presbytie doit frapper dans la tendre jeunesse, sinon il est possible de ne pas pouvoir l'assumer bien longtemps.	https://vitrinelinguistique.oqlf.gouv.qc.ca/21054/le-vocabulaire/improprietes/frapper-impropriete-et-emplois-corrects	semantic	5.0		La presbytie doit frapper dans la tendre jeunesse, sinon il est possible de ne pouvoir pas l'assumer bien longtemps.	b
978	0	La sculpture offre un moyen à Karen de ne penser pas trop à ses problèmes.	https://vitrinelinguistique.oqlf.gouv.qc.ca/23819/les-emprunts-a-langlais/emprunts-semantiques/emploi-deconseille-de-lemprunt-medium	anglicism	5.0		La sculpture offre un moyen à Karen de ne pas penser trop à ses problèmes.	b
979	0	La simplicité volontaire est un phénomène de société tend à ne considérer pas avec assez de sérieux.	https://vitrinelinguistique.oqlf.gouv.qc.ca/24594/le-vocabulaire/nuances-semantiques/difference-entre-collectivite-communaute-et-societe	semantic	5.0		La simplicité volontaire est un phénomène de société tend à ne pas considérer avec assez de sérieux.	b
980	0	La situation en soi paraît n'être pas si dramatique.	https://vitrinelinguistique.oqlf.gouv.qc.ca/23481/la-grammaire/les-pronoms/pronoms-personnels/le-pronom-personnel-soi	morphology	5.0		La situation en soi paraît ne pas être si dramatique.	b
982	0	La situation semble n'empirer pas autant que ce qu’ils avaient prévu.	https://vitrinelinguistique.oqlf.gouv.qc.ca/22296/la-syntaxe/la-comparaison/emplois-de-ladjectif-pire	syntax	5.0		La situation semble ne pas empirer autant que ce qu’ils avaient prévu.	b
985	0	La technologie qu'utilise cette entreprise est si avancée qu'elle devrait n'être jamais découverte par ses concurrents .	https://vitrinelinguistique.oqlf.gouv.qc.ca/23536/les-emprunts-a-langlais/emprunts-integraux/les-emprunts-deconseilles-challenger-et-challengeur	anglicism	5.0		La technologie qu'utilise cette entreprise est si avancée qu'elle devrait ne jamais être découverte par ses concurrents .	b
987	0	Il est difficile de ne comparer pas constamment la valeur du dollar canadien avec celle des devises européennes.	https://vitrinelinguistique.oqlf.gouv.qc.ca/20537/les-emprunts-a-langlais/emprunts-semantiques/emploi-deconseille-de-lemprunt-apprecier	anglicism	5.0		Il est difficile de ne pas comparer constamment la valeur du dollar canadien avec celle des devises européennes.	b
990	0	La clinique du vétérinaire est administrée de sorte qu'il puisse ne travailler pas toute la semaine.	https://vitrinelinguistique.oqlf.gouv.qc.ca/21110/les-emprunts-a-langlais/emprunts-morphologiques/lexpression-deconseillee-a-lannee-longue	anglicism	5.0		La clinique du vétérinaire est administrée de sorte qu'il puisse ne pas travailler toute la semaine.	b
991	0	La Vice-présidence aux finances est chargée de ne dépasser pas le budget attribué pour ce projet.	https://vitrinelinguistique.oqlf.gouv.qc.ca/22675/la-typographie/majuscules/emploi-de-la-majuscule-pour-des-types-de-denominations/majuscule-aux-noms-dunites-administratives	syntax	5.0		La Vice-présidence aux finances est chargée de ne pas dépasser le budget attribué pour ce projet.	b
994	0	Malgré les protestations, la Ville refuse de ne convertir pas cette vieille usine en centre commercial.	https://vitrinelinguistique.oqlf.gouv.qc.ca/24280/la-syntaxe/les-prepositions/preposition-apres-un-verbe/prepositions-a-employer-apres-le-verbe-convertir	syntax	5.0		Malgré les protestations, la Ville refuse de ne pas convertir cette vieille usine en centre commercial.	b
995	0	On devrait repenser l'uniforme: Laura déteste ne porter pas de pantalon noir au travail.	https://vitrinelinguistique.oqlf.gouv.qc.ca/23761/la-grammaire/le-nom/pluriel-des-noms/pluriel-et-sens-du-nom/noms-pouvant-etre-employes-au-singulier-et-au-pluriel	morphology	5.0		On devrait repenser l'uniforme: Laura déteste ne pas porter de pantalon noir au travail.	b
998	0	Le blé est trop blond pour n'être pas coupé.	https://vitrinelinguistique.oqlf.gouv.qc.ca/22236/lorthographe/homophones-lexicaux/les-homophones-ver-verre-vers-vert-et-vair	morphology	5.0		Le blé est trop blond pour ne pas être coupé.	b
1000	0	Le candidat a-t-il trop de qualités pour n'occuper pas cet emploi?	https://vitrinelinguistique.oqlf.gouv.qc.ca/22241/le-vocabulaire/nuances-semantiques/difference-entre-requis-necessaire-exige-et-voulu	semantic	5.0		Le candidat a-t-il trop de qualités pour ne pas occuper cet emploi?	b
1001	0	Le candidat vedette du parti a renversé son adversaire, lequel a quand même décidé de ne se pas retirer de la lutte.	https://vitrinelinguistique.oqlf.gouv.qc.ca/23571/les-emprunts-a-langlais/emprunts-syntaxiques/les-expressions-avoir-le-meilleur-sur-et-prendre-le-meilleur-sur	anglicism	5.0		Le candidat vedette du parti a renversé son adversaire, lequel a quand même décidé de ne pas se retirer de la lutte.	b
1006	0	Le chef de pupitre nous exige de n'oublier pas de bien réviser les unes.	https://vitrinelinguistique.oqlf.gouv.qc.ca/25340/la-typographie/majuscules/emploi-de-la-majuscule-pour-des-noms-particuliers/emploi-de-la-minuscule-pour-le-nom-une-au-sens-de-premiere-page	syntax	5.0		Le chef de pupitre nous exige de ne pas oublier de bien réviser les unes.	b
934	0	La livre égyptienne est une unité monétaire ne pas étant divisible en cent piastres.	https://vitrinelinguistique.oqlf.gouv.qc.ca/23978/le-vocabulaire/nuances-semantiques/difference-entre-dollar-et-piastre	semantic	5.0		La livre égyptienne est une unité monétaire n'étant pas divisible en cent piastres.	c
233	0	Cette bonne nouvelle n'arrive mal dans nos vies.	https://vitrinelinguistique.oqlf.gouv.qc.ca/24489/le-vocabulaire/tours-dhorizon-et-autres-explications/tours-dhorizon/emploi-et-sens-de-a-propos-et-de-a-propos	semantic	7.0		Cette bonne nouvelle arrive mal dans nos vies.	paradigmatique (Larrivée 2004: 37)
240	0	Cette critique de film n'est tout à fait impertinente.	https://vitrinelinguistique.oqlf.gouv.qc.ca/22248/le-vocabulaire/nuances-semantiques/difference-entre-adequat-approprie-et-pertinent	semantic	7.0		Cette critique de film est tout à fait impertinente.	paradigmatique (Larrivée 2004: 37)
243	0	Cette entreprise n'a mal rétabli son équilibre budgétaire.	https://vitrinelinguistique.oqlf.gouv.qc.ca/21980/les-emprunts-a-langlais/emprunts-semantiques/emploi-deconseille-de-lemprunt-balance	anglicism	7.0		Cette entreprise a mal rétabli son équilibre budgétaire.	paradigmatique (Larrivée 2004: 37)
323	0	De toute évidence, il n'avait mal tenu sa promesse.	https://vitrinelinguistique.oqlf.gouv.qc.ca/23609/les-emprunts-a-langlais/emprunts-semantiques/emploi-deconseille-de-lemprunt-evidence	anglicism	7.0		De toute évidence, il avait mal tenu sa promesse.	paradigmatique (Larrivée 2004: 37)
383	0	Elle n'avance d’un pas hésitant, telle une funambule au-dessus d’un ravin.	https://vitrinelinguistique.oqlf.gouv.qc.ca/22437/la-grammaire/ladjectif/accord-de-ladjectif/cas-particuliers-daccord-de-ladjectif/accord-de-tel-dans-tel-que	morphology	7.0		Elle avance d’un pas hésitant, telle une funambule au-dessus d’un ravin.	paradigmatique (Larrivée 2004: 37)
680	0	Je n’ai mal rempli ma fiche d’inscription mais je l’ai remise à l’accueil quand même.	https://vitrinelinguistique.oqlf.gouv.qc.ca/21486/les-emprunts-a-langlais/emprunts-semantiques/emploi-deconseille-de-lemprunt-completer	anglicism	7.0		J’ai mal rempli ma fiche d’inscription mais je l’ai remise à l’accueil quand même.	paradigmatique (Larrivée 2004: 37)
687	0	Je n’ai trouvé peu étrange son comportement.	https://vitrinelinguistique.oqlf.gouv.qc.ca/24285/la-grammaire/la-grammaire-actuelle/les-fonctions/lattribut	morphology	7.0		J’ai trouvé peu étrange son comportement.	paradigmatique (Larrivée 2004: 37)
287	0	Clara n'est spécialiste de que littérature jeunesse.	https://vitrinelinguistique.oqlf.gouv.qc.ca/25195/la-grammaire/le-nom/nombre-des-noms-dans-certains-emplois/nom-complement-dun-autre-nom/invariabilite-du-complement-du-nom-jeunesse	morphology	3.0		Clara n'est spécialiste que de littérature jeunesse.	prédicat nominal
154	0	Ce serait très malvenu que tu quittes la rencontre avant qu’elle soit terminée.	https://vitrinelinguistique.oqlf.gouv.qc.ca/23579/lorthographe/emploi-du-trait-dunion/mots-composes/mots-composes-avec-preposition-ou-adverbe/emploi-du-trait-dunion-dans-les-mots-composes-avec-mal	morphology	7.0		Ce serait très malvenu que tu quittes la rencontre avant qu’elle ne soit terminée.	subordonnée exprimant une éventualité (Larrivée 2004: 22)
3	0	À cette époque, c’était considéré comme des mœurs dissolue.	https://vitrinelinguistique.oqlf.gouv.qc.ca/21735/la-grammaire/ladjectif/formation-particuliere-de-ladjectif-au-masculin-ou-au-feminin/formation-du-feminin-des-adjectifs-absous-dissous-et-resolu	morphology	1.0		À cette époque, c’était considéré comme des mœurs dissolues.	
8	0	À l’époque, il avait parue d’accord avec nous sur ce point.	https://vitrinelinguistique.oqlf.gouv.qc.ca/23843/la-grammaire/le-verbe/auxiliaires/emploi-des-auxiliaires-avec-le-verbe-paraitre	morphology	1.0		À l’époque, il avait paru d’accord avec nous sur ce point.	
11	0	À onze ans, il chausse plus grande que son père.	https://vitrinelinguistique.oqlf.gouv.qc.ca/21609/la-grammaire/ladjectif/adjectif-employe-comme-adverbe/accord-de-grand-employe-comme-adverbe	morphology	1.0		À onze ans, il chausse plus grand que son père.	
34	0	André est persuadé que les ministres prendront positions en faveur de cette réforme.	https://vitrinelinguistique.oqlf.gouv.qc.ca/23482/la-grammaire/le-nom/pluriel-des-noms/noms-dans-les-expressions-figees/expressions-formees-avec-le-mot-position	morphology	1.0		André est persuadé que les ministres prendront position en faveur de cette réforme.	
42	0	Après tous ces efforts, elles se sont senti très fatiguées.	https://vitrinelinguistique.oqlf.gouv.qc.ca/25181/la-grammaire/le-verbe/accord-du-participe-passe/cas-particuliers-daccord-du-participe-passe/accord-particulier-du-participe-passe-dun-verbe-pronominal	morphology	1.0		Après tous ces efforts, elles se sont senties très fatiguées.	
45	0	Assurez-vous d’installer le trampoline sur un terrain stable et parfaitement horizontal.	https://vitrinelinguistique.oqlf.gouv.qc.ca/23280/la-grammaire/le-nom/genre-des-noms/genre-du-nom-trampoline	morphology	1.0		Assurez-vous d’installer la trampoline sur un terrain stable et parfaitement horizontal.	
52	0	Au plus forts de la tempête, le navire tenait bon.	https://vitrinelinguistique.oqlf.gouv.qc.ca/21032/la-grammaire/ladjectif/adjectif-employe-comme-adverbe/fort-employe-comme-adjectif-ou-adverbe	morphology	1.0		Au plus fort de la tempête, le navire tenait bon.	
60	0	Aux dernières élections, ce candidat avait bien parue dans le fameux débat.	https://vitrinelinguistique.oqlf.gouv.qc.ca/23843/la-grammaire/le-verbe/auxiliaires/emploi-des-auxiliaires-avec-le-verbe-paraitre	morphology	1.0		Aux dernières élections, ce candidat avait bien paru dans le fameux débat.	
83	0	C’est la similaritée de ce logiciel avec celui que nous utilisions auparavant qui m’a permis de m’y adapter rapidement.	https://vitrinelinguistique.oqlf.gouv.qc.ca/24458/le-vocabulaire/nuances-semantiques/difference-entre-similitude-et-similarite	semantic	1.0		C’est la similarité de ce logiciel avec celui que nous utilisions auparavant qui m’a permis de m’y adapter rapidement.	
97	0	C’était l’époque de la chasse aux sorcière et du maccarthysme.	https://vitrinelinguistique.oqlf.gouv.qc.ca/24035/la-grammaire/le-nom/nombre-des-noms-dans-certains-emplois/nombre-du-complement-du-nom/nombre-du-nom-complement-de-chasse	morphology	1.0		C’était l’époque de la chasse aux sorcières et du maccarthysme.	
107	0	Ce centre de reprographie propose à ses clients différents supports papiers issus du recyclage.	https://vitrinelinguistique.oqlf.gouv.qc.ca/24646/la-grammaire/le-nom/nombre-des-noms-dans-certains-emplois/nom-complement-dun-autre-nom/invariabilite-du-complement-du-nom-papier	morphology	1.0		Ce centre de reprographie propose à ses clients différents supports papiers issu du recyclage.	
130	0	Ce magasin fermera ses portes et toute la marchandise sera écoulée à demie-prix.	https://vitrinelinguistique.oqlf.gouv.qc.ca/21752/la-grammaire/ladjectif/accord-de-ladjectif/cas-particuliers-daccord-de-ladjectif/emploi-adjectival-et-adverbial-de-demi	morphology	1.0		Ce magasin fermera ses portes et toute la marchandise sera écoulée à demi-prix.	
139	0	Ce nouveau magasin de peinture offre un éventail de couleures.	https://vitrinelinguistique.oqlf.gouv.qc.ca/21494/la-grammaire/le-nom/nombre-des-noms-dans-certains-emplois/cas-particuliers-du-nombre-du-nom/singulier-et-pluriel-du-mot-couleur	morphology	1.0		Ce nouveau magasin de peinture offre un éventail de couleurs.	
187	0	Ces coureurs expérimentés sont très vite sur cent mètres.	https://vitrinelinguistique.oqlf.gouv.qc.ca/22895/la-grammaire/ladverbe/vite-employe-comme-adverbe-ou-adjectif	morphology	1.0		Ces coureurs expérimentés sont très vites sur cent mètres.	
194	0	Ces luxueuses villas se sont vendue facilement.	https://vitrinelinguistique.oqlf.gouv.qc.ca/22957/la-grammaire/le-verbe/verbes-pronominaux/verbe-pronominal-de-sens-passif	morphology	1.0		Ces luxueuses villas se sont vendues facilement.	
195	0	Ces majestueux paquebots, je les ai vus, de mes yeux vues, dans un port de Monaco.	https://vitrinelinguistique.oqlf.gouv.qc.ca/24532/la-grammaire/le-verbe/accord-du-participe-passe/cas-particuliers-daccord-du-participe-passe/accord-du-participe-passe-vu-dans-vu-de-mes-yeux-vu	morphology	1.0		Ces majestueux paquebots, je les ai vus, de mes yeux vus, dans un port de Monaco.	
223	0	Cet ouvrage est un condensée de l’histoire de la langue française au Québec.	https://vitrinelinguistique.oqlf.gouv.qc.ca/24580/le-vocabulaire/nuances-semantiques/difference-entre-concentrer-et-condenser	semantic	1.0		Cet ouvrage est un condensé de l’histoire de la langue française au Québec.	
245	0	Cette entreprise possède un ensemble d’outils de promotion, parmi lesquel on trouve des dépliants et des affiches publicitaires.	https://vitrinelinguistique.oqlf.gouv.qc.ca/23098/la-syntaxe/les-prepositions/preposition-devant-un-nom/la-preposition-parmi	syntax	1.0		Cette entreprise possède un ensemble d’outils de promotion, parmi lesquels on trouve des dépliants et des affiches publicitaires.	
249	0	Cette femme a dispensée des soins aux plus démunis tout au long de sa vie.	https://vitrinelinguistique.oqlf.gouv.qc.ca/23426/le-vocabulaire/improprietes/dispenser-impropriete-et-emplois-corrects	semantic	1.0		Cette femme a dispensé des soins aux plus démunis tout au long de sa vie.	
250	0	Cette femme chante très hautes.	https://vitrinelinguistique.oqlf.gouv.qc.ca/21718/la-grammaire/ladjectif/adjectif-employe-comme-adverbe/haut-employe-comme-adjectif-ou-adverbe	morphology	1.0		Cette femme chante très haut.	
258	0	Cette nouvelle bourse sera décerné à un étudiant ou à une étudiante au baccalauréat en informatique.	https://vitrinelinguistique.oqlf.gouv.qc.ca/24365/le-vocabulaire/paronymes/sens-et-emploi-de-decerner-et-de-discerner	semantic	1.0		Cette nouvelle bourse sera décernée à un étudiant ou à une étudiante au baccalauréat en informatique.	
272	0	Cette troupe de théâtre, parmi laquel j’ai appris le métier d’acteur, présentera un nouveau spectacle au cours de l’été.	https://vitrinelinguistique.oqlf.gouv.qc.ca/23098/la-syntaxe/les-prepositions/preposition-devant-un-nom/la-preposition-parmi	syntax	1.0		Cette troupe de théâtre, parmi laquelle j’ai appris le métier d’acteur, présentera un nouveau spectacle au cours de l’été.	
274	0	Cette vedette est poursuivi par les journalistes.	https://vitrinelinguistique.oqlf.gouv.qc.ca/21547/la-grammaire/le-verbe/accord-du-participe-passe/avec-lauxiliaire-etre/accord-du-participe-passe-employe-avec-lauxiliaire-etre	morphology	1.0		Cette vedette est poursuivie par les journalistes.	
286	0	Ci-joints les photocopies promises.	https://vitrinelinguistique.oqlf.gouv.qc.ca/24223/la-grammaire/le-verbe/accord-du-participe-passe/sans-auxiliaire/synthese-des-regles-daccord-du-participe-passe-employe-sans-auxiliaire	morphology	1.0		Ci-jointes les photocopies promises.	
330	0	Depuis qu’elle vit dans cette famille, elle s’est beaucoup sociabilisé.	https://vitrinelinguistique.oqlf.gouv.qc.ca/24261/le-vocabulaire/nuances-semantiques/difference-entre-socialiser-et-sociabiliser	semantic	1.0		Depuis qu’elle vit dans cette famille, elle s’est beaucoup sociabilisée.	
350	0	Deux rapports d’impôts sont exigées des contribuables du Québec : un est envoyé au gouvernement du Québec et l’autre au gouvernement du Canada.	https://vitrinelinguistique.oqlf.gouv.qc.ca/25440/le-vocabulaire/tours-dhorizon-et-autres-explications/usages/les-appellations-declaration-de-revenus-et-declaration-dimpots	semantic	1.0		Deux rapports d’impôts sont exigés des contribuables du Québec : un est envoyé au gouvernement du Québec et l’autre au gouvernement du Canada.	
368	0	Elle a dérapée et a foncé dans un banc de neige.	https://vitrinelinguistique.oqlf.gouv.qc.ca/25250/le-vocabulaire/tours-dhorizon-et-autres-explications/tours-dhorizon/emploi-et-sens-de-se-ramasser	semantic	1.0		Elle a dérapé et a foncé dans un banc de neige.	
378	0	Elle achète de préférence des produits fabriquée au Canada.	https://vitrinelinguistique.oqlf.gouv.qc.ca/24024/le-vocabulaire/nuances-semantiques/difference-entre-construire-et-fabriquer	semantic	1.0		Elle achète de préférence des produits fabriqués au Canada.	
403	0	Elle ne peut se résoudre à jeter son jean usée jusqu’à la corde.	https://vitrinelinguistique.oqlf.gouv.qc.ca/24561/le-vocabulaire/nuances-semantiques/difference-entre-usage-use-et-usite	semantic	1.0		Elle ne peut se résoudre à jeter son jean usé jusqu’à la corde.	
421	0	Elles ont laissées faire.	https://vitrinelinguistique.oqlf.gouv.qc.ca/21711/la-grammaire/le-verbe/accord-du-participe-passe/cas-particuliers-daccord-du-participe-passe/accord-du-participe-passe-laisse-suivi-dun-infinitif	morphology	1.0		Elles ont laissé faire.	
436	0	En ce temps de réjouissance, Sophie se sent fébrile.	https://vitrinelinguistique.oqlf.gouv.qc.ca/25056/la-grammaire/le-nom/pluriel-des-noms/pluriel-et-sens-du-nom/pluriel-et-sens-de-rejouissance	morphology	1.0		En ce temps de réjouissances, Sophie se sent fébrile.	
438	0	En cette période de canicule, le confort que procure l’air climatisée des centres commerciaux semble très recherché.	https://vitrinelinguistique.oqlf.gouv.qc.ca/25430/le-vocabulaire/tours-dhorizon-et-autres-explications/mises-au-point/climatise-et-conditionne-mise-au-point	semantic	1.0		En cette période de canicule, le confort que procure l’air climatisé des centres commerciaux semble très recherché.	
442	0	En définitif, il vaut mieux réévaluer la situation avant d’intervenir.	https://vitrinelinguistique.oqlf.gouv.qc.ca/22495/le-vocabulaire/barbarismes-lexicaux/en-definitive-et-le-barbarisme-en-definitif	semantic	1.0		En définitive, il vaut mieux réévaluer la situation avant d’intervenir.	
448	0	En retraçant les différentes contraintes qu’une roche a eue à subir, on comprend mieux son état actuel.	https://vitrinelinguistique.oqlf.gouv.qc.ca/25201/la-grammaire/le-verbe/accord-du-participe-passe/cas-particuliers-daccord-du-participe-passe/accord-des-participes-passes-eu-donne-et-laisse-suivis-de-a-et-dun-infinitif	morphology	1.0		En retraçant les différentes contraintes qu’une roche a eu à subir, on comprend mieux son état actuel.	
450	0	En voulant brancher le réfrigérateur, elle a été légèrement électrocuté.	https://vitrinelinguistique.oqlf.gouv.qc.ca/25232/le-vocabulaire/nuances-semantiques/difference-entre-electriser-et-electrocuter	semantic	1.0		En voulant brancher le réfrigérateur, elle a été légèrement électrocutée.	
488	0	Hélène s’est finalement senti piqué par l’abeille qui tournait autour d’elle.	https://vitrinelinguistique.oqlf.gouv.qc.ca/21614/la-grammaire/le-verbe/modes/infinitif/distinction-entre-linfinitif-et-le-participe-passe	morphology	1.0		Hélène s’est finalement senti piquée par l’abeille qui tournait autour d’elle.	
509	0	Il a plus toute la journée.	https://vitrinelinguistique.oqlf.gouv.qc.ca/21544/la-grammaire/le-verbe/accord-du-participe-passe/avec-lauxiliaire-avoir/invariabilite-du-participe-passe-des-verbes-impersonnels	morphology	1.0		Il a plu toute la journée.	
567	0	Il importe de protéger nos infrastructures numériques contre toute activité qui pourrait compromettre la sécuritée nationale.	https://vitrinelinguistique.oqlf.gouv.qc.ca/24601/le-vocabulaire/nuances-semantiques/difference-entre-securite-surete-et-securitaire	semantic	1.0		Il importe de protéger nos infrastructures numériques contre toute activité qui pourrait compromettre la sécurité nationale.	
572	0	Il m’a parue soucieux quand je l’ai rencontré.	https://vitrinelinguistique.oqlf.gouv.qc.ca/23843/la-grammaire/le-verbe/auxiliaires/emploi-des-auxiliaires-avec-le-verbe-paraitre	morphology	1.0		Il m’a paru soucieux quand je l’ai rencontré.	
628	0	Ils ont formé de nouveaux groupes témoin.	https://vitrinelinguistique.oqlf.gouv.qc.ca/21689/la-grammaire/le-nom/nombre-des-noms-dans-certains-emplois/nom-complement-dun-autre-nom/accord-en-nombre-du-complement-du-nom-temoin	morphology	1.0		Ils ont formé de nouveaux groupes témoins.	
653	0	Ils vont couper courts à leur entretien.	https://vitrinelinguistique.oqlf.gouv.qc.ca/21605/la-grammaire/ladjectif/adjectif-employe-comme-adverbe/court-employe-comme-adjectif-ou-adverbe	morphology	1.0		Ils vont couper court à leur entretien.	
668	0	J’ai été opérés des amygdales quand j’étais petit.	https://vitrinelinguistique.oqlf.gouv.qc.ca/23887/la-syntaxe/le-complement-du-verbe/operer-et-ses-complements	syntax	1.0		J’ai été opéré des amygdales quand j’étais petit.	
