id	label	sentence_bad	source	category	type	subcat	sentence_good	commentaire
1104	0	Le rouge avec lequel le professeur indique une faute la devrait permettre de trouver facilement.	https://vitrinelinguistique.oqlf.gouv.qc.ca/24686/la-grammaire/les-determinants/determinants-definis/determinant-defini-devant-un-autonyme	morphology	6.0		Le rouge avec lequel le professeur indique une faute devrait permettre de la trouver facilement.	
1105	0	Le talent et le dynamisme de cette athlète lui devraient faire mériter d'être récompensée aux prochains Jeux olympiques.	https://vitrinelinguistique.oqlf.gouv.qc.ca/24543/les-emprunts-a-langlais/emprunts-integraux/lemprunt-deconseille-drive	anglicism	6.0		Le talent et le dynamisme de cette athlète devraient lui faire mériter d'être récompensée aux prochains Jeux olympiques.	
1106	0	La période du temps des fêtes nous sert à rappeler les moments chaleureux de notre enfance.	https://vitrinelinguistique.oqlf.gouv.qc.ca/25056/la-grammaire/le-nom/pluriel-des-noms/pluriel-et-sens-du-nom/pluriel-et-sens-de-rejouissance	morphology	6.0		La période du temps des fêtes sert à nous rappeler les moments chaleureux de notre enfance.	
1107	0	Ce projet de construction nécessitera l'achat du terrain.	https://vitrinelinguistique.oqlf.gouv.qc.ca/22312/le-vocabulaire/nuances-semantiques/difference-entre-commencer-et-debuter	semantic	10.0	87.0	Ce projet de construction nécessitera l'achat d'un terrain.	
1108	0	Le territoire d'une région administrative contient toujours la certaine densité de population.	https://vitrinelinguistique.oqlf.gouv.qc.ca/22651/la-typographie/majuscules/emploi-de-la-majuscule-pour-des-noms-particuliers/emploi-de-la-majuscule-et-du-trait-dunion-dans-lappellation-capitale-nationale	syntax	10.0	87.0	Le territoire d'une région administrative contient toujours la certaine densité de population.	
1109	0	La fête nationale de l’Acadie devrait causer tout le tintamarre.	https://vitrinelinguistique.oqlf.gouv.qc.ca/23343/la-typographie/majuscules/emploi-de-la-majuscule-pour-des-types-de-denominations/emploi-de-la-majuscule-pour-les-noms-de-fetes-religieuses-civiles-ou-nationales	syntax	10.0	87.0	La fête nationale de l’Acadie devrait causer tout un tintamarre.	
1111	0	En théorie, un prédicat est composé du verbe et de ses arguments.	https://vitrinelinguistique.oqlf.gouv.qc.ca/23355/la-ponctuation/trait-dunion/le-trait-dunion-dans-les-unites-lexicales	syntax	10.0	87.0	En théorie, un prédicat est composé d'un verbe et de ses arguments.	
1113	0	Les habitants du village de L’Islet-sur-Mer veulent développer leur municipalité afin de devenir la ville.	https://vitrinelinguistique.oqlf.gouv.qc.ca/24492/lorthographe/cas-particuliers-lies-a-lorthographe/les-variantes-orthographiques-ile-ile-et-isle	morphology	10.0	87.0	Les habitants du village de L’Islet-sur-Mer veulent développer leur municipalité afin de devenir la ville.	
1114	0	Le virement est une opération qui implique qu'un montant prélèvé est déposé dans l'autre compte.	https://vitrinelinguistique.oqlf.gouv.qc.ca/25267/la-syntaxe/les-prepositions/preposition-apres-un-verbe/prepositions-a-employer-apres-le-verbe-prelever	syntax	10.0	87.0	Le virement est une opération qui implique qu'un montant prélèvé est déposé dans un autre compte.	
1116	0	Si Louis vise à perdre du poids, il faut lui trouver le régime à suivre.	https://vitrinelinguistique.oqlf.gouv.qc.ca/25383/la-typographie/mise-en-relief/italique/mise-en-relief-des-noms-de-sites-web-et-de-blogues	syntax	10.0	87.0	Si Louis vise à perdre du poids, il faut lui trouver un régime à suivre.	
1118	0	Les adeptes du minimalisme pensent que l'accumulation de possessions matérielles est l'habitude à éviter.	https://vitrinelinguistique.oqlf.gouv.qc.ca/22453/le-vocabulaire/nuances-semantiques/difference-entre-adepte-et-disciple	semantic	10.0	87.0	Les adeptes du minimalisme pensent que l'accumulation de possessions matérielles est une habitude à éviter.	
1120	0	Les alentours du centre-ville sont toujours animés lors de la belle journée d’été.	https://vitrinelinguistique.oqlf.gouv.qc.ca/22938/la-grammaire/ladverbe/alentour-employe-comme-adverbe-nom-ou-dans-une-preposition-composee	morphology	10.0	87.0	Les alentours du centre-ville sont toujours animés lors d'une belle journée d’été.	
1121	0	Les arbres aménagés dans ce parc forment l'espèce de couronne.	https://vitrinelinguistique.oqlf.gouv.qc.ca/24082/la-redaction-et-la-communication/figures-de-style/figures-jouant-sur-le-sens/la-personnification	syntax	10.0	87.0	Les arbres aménagés dans ce parc forment une espèce de couronne.	
1122	0	Les attraits du jeu étaient tellement importants qu’il oubliait qu'il avait la famille.	https://vitrinelinguistique.oqlf.gouv.qc.ca/24468/lorthographe/homophones-lexicaux/les-homophones-attrait-et-a-trait	morphology	10.0	87.0	Les attraits du jeu étaient tellement importants qu’il oubliait qu'il avait une famille.	
1123	0	Les autorités ont presque lancé le mandat d’arrêt contre ce suspect.	https://vitrinelinguistique.oqlf.gouv.qc.ca/24076/les-emprunts-a-langlais/emprunts-semantiques/emploi-deconseille-de-lemprunt-emettre	anglicism	10.0	87.0	Les autorités ont presque lancé un mandat d’arrêt contre ce suspect.	
1126	0	Les bébés ont besoin du support de l'objet pour se tenir debout.	https://vitrinelinguistique.oqlf.gouv.qc.ca/22316/la-syntaxe/les-prepositions/preposition-apres-un-verbe/prepositions-a-employer-apres-le-verbe-commencer	syntax	10.0	87.0	Les bébés ont besoin du support d'un objet pour se tenir debout.	
1127	0	Les apprentis espèrent tous un jour peindre le chef-d'oeuvre.	https://vitrinelinguistique.oqlf.gouv.qc.ca/21953/le-vocabulaire/nuances-semantiques/difference-entre-peindre-et-peinturer	semantic	10.0	87.0	Les apprentis espèrent tous un jour peindre un chef-d'oeuvre.	
1128	0	On s'attendait au meilleur rendement.	https://vitrinelinguistique.oqlf.gouv.qc.ca/25281/la-syntaxe/les-prepositions/preposition-apres-un-verbe/prepositions-a-employer-apres-le-verbe-sattendre	syntax	10.0	87.0	On s'attendait à un meilleur rendement.	
1129	0	Les boutiques de la région métropolitaine ont prévu la hausse de fréquentation pour ce trimestre.	https://vitrinelinguistique.oqlf.gouv.qc.ca/25218/les-noms-propres/noms-geographiques-et-gentiles/toponymes-et-gentiles-du-quebec/grand-devant-un-nom-de-ville	syntax	10.0	87.0	Les boutiques de la région métropolitaine ont prévu une hausse de fréquentation pour ce trimestre.	
1133	0	Tous les candidats non admissibles au concours essuieront la defaite.	https://vitrinelinguistique.oqlf.gouv.qc.ca/20994/les-emprunts-a-langlais/emprunts-semantiques/emploi-deconseille-de-lemprunt-eligible	anglicism	10.0	87.0	Tous les candidats non admissibles au concours essuieront une defaite.	
1135	0	Les chercheurs s’intéressent de plus en plus aux jeunes ayant la dépendence aux réseaux sociaux.	https://vitrinelinguistique.oqlf.gouv.qc.ca/25313/les-emprunts-a-langlais/emprunts-integraux/lemprunt-deconseille-addict	anglicism	10.0	87.0	Les chercheurs s’intéressent de plus en plus aux jeunes ayant une dépendence aux réseaux sociaux.	
1136	0	Les circonstances ont fait que tout le monde a pu bénéficier de l'atterrissage sécuritaire.	https://vitrinelinguistique.oqlf.gouv.qc.ca/23650/le-vocabulaire/nuances-semantiques/difference-entre-faire-que-et-faire-en-sorte-que	semantic	10.0	87.0	Les circonstances ont fait que tout le monde a pu bénéficier d'un atterrissage sécuritaire.	
1137	0	Les collaborateurs de cette revue recoivent toujours la rémunération.	https://vitrinelinguistique.oqlf.gouv.qc.ca/22456/le-vocabulaire/barbarismes-lexicaux/remunerer-et-le-barbarisme-renumerer	semantic	10.0	87.0	Les collaborateurs de cette revue recoivent toujours une rémunération.	
1141	0	Les coupables pensent être condamnés à la peine d’emprisonnement.	https://vitrinelinguistique.oqlf.gouv.qc.ca/23366/la-ponctuation/barre-oblique/generalites-sur-la-barre-oblique	syntax	10.0	87.0	Les coupables pensent être condamnés à une peine d’emprisonnement.	
1144	0	Les cyclistes peuvent rouler à contresens sur la voie à sens unique.	https://vitrinelinguistique.oqlf.gouv.qc.ca/24639/le-vocabulaire/nuances-semantiques/difference-entre-contresens-et-sens-inverse	semantic	10.0	87.0	Les cyclistes peuvent rouler à contresens sur une voie à sens unique.	
1145	0	Les entreprises cherchent à éviter de se causer la dépense inutile.	https://vitrinelinguistique.oqlf.gouv.qc.ca/21965/le-vocabulaire/pleonasmes/le-pleonasme-saverer-vrai-et-lexpression-contradictoire-saverer-faux	semantic	10.0	87.0	Les entreprises cherchent à éviter de se causer une dépense inutile.	
1147	0	Votre père vous aurait peut-être laissé l'héritage considérable s'il n'avait pas eu autant de dettes non remboursées.	https://vitrinelinguistique.oqlf.gouv.qc.ca/25201/la-grammaire/le-verbe/accord-du-participe-passe/cas-particuliers-daccord-du-participe-passe/accord-des-participes-passes-eu-donne-et-laisse-suivis-de-a-et-dun-infinitif	morphology	10.0	87.0	Votre père vous aurait peut-être laissé un héritage considérable s'il n'avait pas eu autant de dettes non remboursées.	
1148	0	Le responsable de l'assistance doit avoir la bouteille d'eau en tout temps.	https://vitrinelinguistique.oqlf.gouv.qc.ca/24416/le-vocabulaire/nuances-semantiques/difference-entre-composant-et-composante	semantic	10.0	87.0	Le responsable de l'assistance doit avoir une bouteille d'eau en tout temps.	
1150	0	Les deux pays se sont consultés sur l'éventualité du projet aérospatial.	https://vitrinelinguistique.oqlf.gouv.qc.ca/24294/la-syntaxe/les-prepositions/preposition-apres-un-verbe/prepositions-a-employer-apres-le-verbe-saccorder	syntax	10.0	87.0	Les deux pays se sont consultés sur l'éventualité d'un projet aérospatial.	
1151	0	Les deux vice-présidents refusent d'aborder l'idée de la possible collaboration.	https://vitrinelinguistique.oqlf.gouv.qc.ca/23670/les-emprunts-a-langlais/emprunts-semantiques/emploi-deconseille-de-lemprunt-exonerer	anglicism	10.0	87.0	Les deux vice-présidents refusent d'aborder l'idée d'une possible collaboration.	
1152	0	Les discours techno-utopiques de ces militants ont la certaine touche humoristique.	https://vitrinelinguistique.oqlf.gouv.qc.ca/25211/lorthographe/emploi-du-trait-dunion/mots-composes/mots-composes-avec-prefixe-ou-element-grec-ou-latin/trait-dunion-ou-soudure-avec-lelement-techno8216	morphology	10.0	87.0	Les discours techno-utopiques de ces militants ont une certaine touche humoristique.	
1155	0	Les militants écologistes d'aujourd'hui bénéficient du certain poids politique.	https://vitrinelinguistique.oqlf.gouv.qc.ca/22905/la-grammaire/le-verbe/construction-de-certains-verbes/emploi-du-verbe-objecter	morphology	10.0	87.0	Les militants écologistes d'aujourd'hui bénéficient d'un certain poids politique.	
1156	0	La population d’éléphants en Asie aurait connu la diminution d’au moins 50 % au cours des trois dernières générations.	https://vitrinelinguistique.oqlf.gouv.qc.ca/22553/le-vocabulaire/improprietes/le-sens-du-nom-demeure-dans-peril-en-la-demeure	semantic	10.0	87.0	La population d’éléphants en Asie aurait connu une diminution d’au moins 50 % au cours des trois dernières générations.	
1158	0	Les électeurs n’aiment pas les politiciens agressifs, ils n'ont pas l'impression qu'ils leur peuvent faire confiance.	https://vitrinelinguistique.oqlf.gouv.qc.ca/24418/les-emprunts-a-langlais/emprunts-integraux/lemprunt-deconseille-turn-off	anglicism	6.0		Les électeurs n’aiment pas les politiciens agressifs, ils n'ont pas l'impression qu'ils peuvent leur faire confiance.	
1160	0	Les élèves qui aiment l'école y veulent rester jusqu'à l'heure du souper.	https://vitrinelinguistique.oqlf.gouv.qc.ca/21319/la-grammaire/ladverbe/emploi-adverbial-et-adjectival-de-meme	morphology	6.0		Les élèves qui aiment l'école veulent y rester jusqu'à l'heure du souper.	
1162	0	Les enfants qui aiment les pâtés les préfèrent manger avec du ketchup.	https://vitrinelinguistique.oqlf.gouv.qc.ca/22216/lorthographe/homophones-lexicaux/les-homophones-pate-et-patee	morphology	6.0		Les enfants qui aiment les pâtés préfèrent les manger avec du ketchup.	
1165	0	Les enfants dessinent sur les murs et, ce faisant, ils se risquent de salir les mains.	https://vitrinelinguistique.oqlf.gouv.qc.ca/24802/la-grammaire/les-homophones-grammaticaux/les-homophones-ce-et-se-devant-le-verbe-faire	morphology	6.0		Les enfants dessinent sur les murs et, ce faisant, ils risquent de se salir les mains.	
1166	0	Les enfants qui avaient des cravates les paraissaient porter contre leur gré.	https://vitrinelinguistique.oqlf.gouv.qc.ca/23852/le-vocabulaire/nuances-semantiques/difference-entre-paraitre-et-apparaitre	semantic	6.0		Les enfants qui avaient des cravates paraissaient les porter contre leur gré.	
1167	0	Les parents qui gâtent leurs enfants les aiment voir déballer leurs cadeaux.	https://vitrinelinguistique.oqlf.gouv.qc.ca/20841/les-emprunts-a-langlais/emprunts-semantiques/emploi-deconseille-de-lemprunt-etre-anxieux-de	anglicism	6.0		Les parents qui gâtent leurs enfants aiment les voir déballer leurs cadeaux.	
1169	0	Une entreprise attachée à un parti politique lui peut faire un don de 2000 $.	https://vitrinelinguistique.oqlf.gouv.qc.ca/22531/les-emprunts-a-langlais/emprunts-semantiques/emploi-deconseille-des-emprunts-supporter-et-support	anglicism	6.0		Une entreprise attachée à un parti politique peut lui faire un don de 2000 $.	
1173	0	Les familles incidemment touchées par ces mesures en devraient recevoir un dédommagement.	https://vitrinelinguistique.oqlf.gouv.qc.ca/21239/les-emprunts-a-langlais/emprunts-semantiques/emploi-deconseille-de-lemprunt-incidemment	anglicism	6.0		Les familles incidemment touchées par ces mesures devraient en recevoir un dédommagement.	
1174	0	Les fautes commises pendant cette partie la concourrurent à rendre pénible.	https://vitrinelinguistique.oqlf.gouv.qc.ca/24155/le-vocabulaire/tours-dhorizon-et-autres-explications/usages/emploi-de-bien-mal-mieux-paraitre	semantic	6.0		Les fautes commises pendant cette partie concourrurent à la rendre pénible.	
1175	0	Les fermes bovines ont été gravement touchées par la crise, mais le gouvernement en leur attribue la cause.	https://vitrinelinguistique.oqlf.gouv.qc.ca/24304/la-grammaire/la-grammaire-actuelle/les-classes-de-mots-et-les-groupes/ladjectif-et-le-groupe-adjectival	morphology	6.0		Les fermes bovines ont été gravement touchées par la crise, mais le gouvernement leur en attribue la cause.	
1176	0	Les feuilles se sont ramassées sur la grille d’égout, ce qui la risque d'empêcher d’évacuer l’eau de pluie.	https://vitrinelinguistique.oqlf.gouv.qc.ca/25250/le-vocabulaire/tours-dhorizon-et-autres-explications/tours-dhorizon/emploi-et-sens-de-se-ramasser	semantic	6.0		Les feuilles se sont ramassées sur la grille d’égout, ce qui risque de l'empêcher d’évacuer l’eau de pluie.	
1177	0	Le confort de notre foyer nous y autorise à rester plus souvent qu'autrement.	https://vitrinelinguistique.oqlf.gouv.qc.ca/21819/la-grammaire/ladjectif/masculin-pluriel-des-adjectifs-en-8209al	morphology	6.0		Le confort de notre foyer nous autorise à y rester plus souvent qu'autrement.	
1178	0	Le meilleur moyen de vaincre un cancer du col de l’utérus est d'en aller parler avec un médecin spécialiste.	https://vitrinelinguistique.oqlf.gouv.qc.ca/25199/lorthographe/emploi-du-trait-dunion/mots-composes/mots-composes-avec-mot-tronque-comme-premier-element/trait-dunion-ou-soudure-avec-lelement-cervico	morphology	6.0		Le meilleur moyen de vaincre un cancer du col de l’utérus est d'aller en parler avec un médecin spécialiste.	
1179	0	Les gens qui assistaient au défilé sautillaient sur place pour se tenter de réchauffer.	https://vitrinelinguistique.oqlf.gouv.qc.ca/22181/le-vocabulaire/pleonasmes/le-pleonasme-pietiner-sur-place	semantic	6.0		Les gens qui assistaient au défilé sautillaient sur place pour tenter de se réchauffer.	
1181	0	Les hausses de salaire des techniciens les viseront principalement à empêcher d'entrer en grève.	https://vitrinelinguistique.oqlf.gouv.qc.ca/24070/les-emprunts-a-langlais/emprunts-semantiques/emploi-deconseille-de-lemprunt-affecter	anglicism	6.0		Les hausses de salaire des techniciens viseront principalement à les empêcher d'entrer en grève.	
1185	0	Les inspecteurs ont dressé un bilan provisoire de la situation.	https://vitrinelinguistique.oqlf.gouv.qc.ca/22321/le-vocabulaire/nuances-semantiques/difference-entre-preliminaire-et-provisoire	semantic			Les inspecteurs ont dressé un bilan provisoire de la situation.	
1186	0	Les jeunes ont pris la gageure de rendre leur école propre et écologique.	https://vitrinelinguistique.oqlf.gouv.qc.ca/23105/le-vocabulaire/tours-dhorizon-et-autres-explications/usages/emploi-de-gageure-et-gager	semantic			Les jeunes ont pris la gageure de rendre leur école propre et écologique.	
1187	0	Les jeux d’été et d’hiver se tiennent en alternance; il y a donc des Olympiques tous les deux ans.	https://vitrinelinguistique.oqlf.gouv.qc.ca/21314/la-typographie/majuscules/emploi-de-la-majuscule-pour-des-types-de-denominations/majuscule-aux-noms-de-manifestations-commerciales-culturelles-et-sportives	syntax			Les jeux d’été et d’hiver se tiennent en alternance; il y a donc des Olympiques tous les deux ans.	
1188	0	Les journaux rapportent des développements dans les négociations.	https://vitrinelinguistique.oqlf.gouv.qc.ca/20989/les-emprunts-a-langlais/emprunts-semantiques/emploi-deconseille-de-lemprunt-developpement	anglicism			Les journaux rapportent des développements dans les négociations.	
1189	0	Les lauréats d’un prix Nobel sont déterminés au cours du mois d’octobre de chaque année.	https://vitrinelinguistique.oqlf.gouv.qc.ca/25194/le-vocabulaire/nuances-semantiques/difference-entre-laureat-et-recipiendaire	semantic			Les lauréats d’un prix Nobel sont déterminés au cours du mois d’octobre de chaque année.	
1190	0	Les liens vers d’autres pages Web se trouvent dans la webthèque.	https://vitrinelinguistique.oqlf.gouv.qc.ca/25059/lorthographe/emploi-du-trait-dunion/cas-particuliers-demploi-du-trait-dunion/trait-dunion-dans-les-mots-formes-avec-web8210	morphology			Les liens vers d’autres pages Web se trouvent dans la webthèque.	
1191	0	Les loyalistes ont affronté les patriotes au cours des rébellions de 1837 et 1838.	https://vitrinelinguistique.oqlf.gouv.qc.ca/22660/la-typographie/majuscules/emploi-de-la-majuscule-pour-des-types-de-denominations/majuscule-aux-noms-de-partis-politiques	syntax			Les loyalistes ont affronté les patriotes au cours des rébellions de 1837 et 1838.	
1192	0	Les mains dans les poches, insouciant en apparence, mais au fond, angoissé et nerveux, il suivait du regard la voiture qui s’éloignait.	https://vitrinelinguistique.oqlf.gouv.qc.ca/21959/le-vocabulaire/pleonasmes/le-pleonasme-apparence-exterieure	semantic			Les mains dans les poches, insouciant en apparence, mais au fond, angoissé et nerveux, il suivait du regard la voiture qui s’éloignait.	
1193	0	Les maires de la Rive-Sud sont contre le transport du pétrole par train dans leur ville.	https://vitrinelinguistique.oqlf.gouv.qc.ca/25169/la-typographie/majuscules/emploi-de-la-majuscule-pour-des-noms-particuliers/emploi-des-majuscules-et-du-trait-dunion-dans-rive-nord-et-rive-sud	syntax			Les maires de la Rive-Sud sont contre le transport du pétrole par train dans leur ville.	
1194	0	Les maisons neuves qui avaient été détruites par les inondations ont été reconstruites un an plus tard.	https://vitrinelinguistique.oqlf.gouv.qc.ca/24904/la-ponctuation/virgule/la-virgule-et-les-subordonnees-relatives-determinatives-et-explicatives	syntax			Les maisons neuves qui avaient été détruites par les inondations ont été reconstruites un an plus tard.	
1195	0	Les manèges sont hyperintenses cette année.	https://vitrinelinguistique.oqlf.gouv.qc.ca/22790/les-emprunts-a-langlais/emprunts-integraux/lemprunt-deconseille-full	anglicism			Les manèges sont hyperintenses cette année.	
1196	0	Les mannequins qui participent à ce défilé sont très photogéniques.	https://vitrinelinguistique.oqlf.gouv.qc.ca/23138/lorthographe/emploi-du-trait-dunion/mots-composes/mots-composes-avec-prefixe-ou-element-grec-ou-latin/trait-dunion-ou-soudure-avec-lelement-photo8211	morphology			Les mannequins qui participent à ce défilé sont très photogéniques.	
1198	0	Les membres de la famille étaient tout en larmes.	https://vitrinelinguistique.oqlf.gouv.qc.ca/22907/la-grammaire/ladverbe/tout-employe-comme-adverbe	morphology			Les membres de la famille étaient tout en larmes.	
1199	0	Les membres du bureau syndical n’ont pas encore discuté de ce point.	https://vitrinelinguistique.oqlf.gouv.qc.ca/24240/les-emprunts-a-langlais/emprunts-semantiques/emplois-deconseilles-de-executif	anglicism			Les membres du bureau syndical n’ont pas encore discuté de ce point.	
1200	0	Les meubles du salon sont acajou.	https://vitrinelinguistique.oqlf.gouv.qc.ca/21721/la-grammaire/ladjectif/accord-de-ladjectif/adjectifs-de-couleur/accord-des-adjectifs-de-couleur-de-forme-simple	morphology			Les meubles du salon sont acajou.	
1201	0	Les militaires en mission dans ces territoires sont soumis aux mêmes conditions.	https://vitrinelinguistique.oqlf.gouv.qc.ca/23669/les-emprunts-a-langlais/emprunts-morphologiques/emploi-deconseille-de-en-devoir	anglicism			Les militaires en mission dans ces territoires sont soumis aux mêmes conditions.	
1203	0	Les murs de son bureau sont beiges.	https://vitrinelinguistique.oqlf.gouv.qc.ca/24067/les-emprunts-a-langlais/emprunts-integraux/lemprunt-deconseille-drabe	anglicism			Les murs de son bureau sont beiges.	
1206	0	Les oiseaux émigrent parce qu’ils manquent de nourriture à l’approche de l’hiver.	https://vitrinelinguistique.oqlf.gouv.qc.ca/22544/le-vocabulaire/paronymes/sens-et-emploi-de-emigrer-et-de-immigrer	semantic			Les oiseaux émigrent parce qu’ils manquent de nourriture à l’approche de l’hiver.	
1207	0	Les ouvrages didactiques sur ce sujet sont abondants.	https://vitrinelinguistique.oqlf.gouv.qc.ca/21954/les-emprunts-a-langlais/emprunts-semantiques/emploi-deconseille-de-lemprunt-academique	anglicism			Les ouvrages didactiques sur ce sujet sont abondants.	
1209	0	Les parents souhaitent outiller les préadolescents pour qu’ils puissent faire face à l’hypersexualisation.	https://vitrinelinguistique.oqlf.gouv.qc.ca/25225/le-vocabulaire/tours-dhorizon-et-autres-explications/tours-dhorizon/emploi-et-sens-de-outiller	semantic			Les parents souhaitent outiller les préadolescents pour qu’ils puissent faire face à l’hypersexualisation.	
1210	0	Les parties qui négociaient étaient nulles autres que le syndic et le promoteur.	https://vitrinelinguistique.oqlf.gouv.qc.ca/20429/la-grammaire/les-determinants/determinants-indefinis/accord-du-determinant-indefini-nul	morphology			Les parties qui négociaient étaient nulles autres que le syndic et le promoteur.	
1212	0	Les partisans ont éclaté en applaudissements devant les nouveaux élus.	https://vitrinelinguistique.oqlf.gouv.qc.ca/25188/les-emprunts-a-langlais/emprunts-syntaxiques/lexpression-deconseillee-donner-une-bonne-main-dapplaudissements	anglicism			Les partisans ont éclaté en applaudissements devant les nouveaux élus.	
1214	0	Les passants s’attroupaient devant cette statue faite en or et en marbre.	https://vitrinelinguistique.oqlf.gouv.qc.ca/22167/la-syntaxe/les-prepositions/preposition-devant-un-nom/les-prepositions-introduisant-une-matiere	syntax			Les passants s’attroupaient devant cette statue faite en or et en marbre.	
1215	0	Les Pensées de Pascal devraient figurer dans toute bonne bibliothèque.	https://vitrinelinguistique.oqlf.gouv.qc.ca/23125/la-grammaire/le-verbe/accord-du-verbe-avec-le-sujet/cas-particuliers-daccord-du-verbe/accord-du-verbe-avec-un-titre-doeuvre	morphology			Les Pensées de Pascal devraient figurer dans toute bonne bibliothèque.	
1218	0	Les plaisirs volatils ne sont pas du même ordre que le bonheur.	https://vitrinelinguistique.oqlf.gouv.qc.ca/23781/lorthographe/homophones-lexicaux/les-homophones-volatil-et-volatile	morphology			Les plaisirs volatils ne sont pas du même ordre que le bonheur.	
1220	0	Les policiers considèrent le caissier comme un témoin important dans cette affaire.	https://vitrinelinguistique.oqlf.gouv.qc.ca/23775/la-syntaxe/les-prepositions/preposition-apres-un-verbe/preposition-comme-apres-le-verbe-considerer	syntax			Les policiers considèrent le caissier comme un témoin important dans cette affaire.	
1221	0	Les policiers nous avaient enjoint d’arrêter la voiture sur-le-champ.	https://vitrinelinguistique.oqlf.gouv.qc.ca/22901/la-syntaxe/les-prepositions/preposition-apres-un-verbe/preposition-a-employer-apres-le-verbe-enjoindre	syntax			Les policiers nous avaient enjoint d’arrêter la voiture sur-le-champ.	
1223	0	Les policiers ont trouvé chez lui un objet particulièrement intrigant.	https://vitrinelinguistique.oqlf.gouv.qc.ca/25231/le-vocabulaire/tours-dhorizon-et-autres-explications/usages/ladjectif-intrigant	semantic			Les policiers ont trouvé chez lui un objet particulièrement intrigant.	
1224	0	Les problèmes de santé publique sont du domaine public.	https://vitrinelinguistique.oqlf.gouv.qc.ca/23710/lorthographe/problemes-lies-aux-consonnes/la-graphie-des-finales-en-ik-ic-ou-ique	morphology			Les problèmes de santé publique sont du domaine public.	
1225	0	Les progrès de la médecine permettent de mieux détecter les malformations congénitales.	https://vitrinelinguistique.oqlf.gouv.qc.ca/22320/le-vocabulaire/nuances-semantiques/difference-entre-hereditaire-et-congenital	semantic			Les progrès de la médecine permettent de mieux détecter les malformations congénitales.	
